movie name,imdb name,year,description,trailer link,movie id,imdb score,rotten score,cinema score,user score
Valhalla Rising,Valhalla Rising,2010,"Valhalla Rising is a movie starring Mads Mikkelsen, Maarten Stevenson, and Alexander Morton. Forced for some time to be a fighting slave, a pagan warrior escapes his captors with a boy and joins a group of Crusaders on their quest...",https://www.imdb.com/video/imdb/vi78317081,tt0862467,6.1,71,Cinemascore,NA
Countdown To Zero,Countdown to Zero,2010,"Countdown to Zero is a movie starring Graham Allison, James Baker III, and Bruce Blair. A documentary about how the likelihood of nuclear weapons (or fissile materials) usage has increased due to the rise of terrorism and lack of...",https://www.imdb.com/video/imdb/vi318899993,tt1572769,6.9,79,Cinemascore,NA
Life During Wartime,Life During Wartime,2010,"Life During Wartime is a movie starring Shirley Henderson, Allison Janney, and Ally Sheedy. Friends, family, and lovers struggle to find love, forgiveness, and meaning in an almost war-torn world riddled with comedy and pathos.",https://www.imdb.com/video/imdb/vi2739734297,tt0808526,6.4,56,Cinemascore,NA
Ramona And Beezus,Ramona and Beezus,2010,"Ramona and Beezus is a movie starring Joey King, Selena Gomez, and Bridget Moynahan. An adventurous young girl uses her imagination to escape her reality, that is quickly spinning out of reach.",https://www.imdb.com/video/imdb/vi2269972249,tt0493949,6.5,70,Cinemascore,NA
Salt,Salt,2010,"Salt is a movie starring Angelina Jolie, Liev Schreiber, and Chiwetel Ejiofor. A CIA agent goes on the run after a defector accuses her of being a Russian spy.",https://www.imdb.com/video/imdb/vi1236141849,tt0944835,6.4,,Cinemascore,NA
Cats And Dogs 2,Cats & Dogs: The Revenge of Kitty Galore,2010,"Cats & Dogs: The Revenge of Kitty Galore is a movie starring Bette Midler, Chris O'Donnell, and Jack McBrayer. The on-going war between the canine and feline species is put on hold when they join forces to thwart a rogue cat spy...",https://www.imdb.com/video/imdb/vi3966109465,tt1287468,4.3,,Cinemascore,NA
Charlie St. Cloud,Charlie St. Cloud,2010,"Charlie St. Cloud is a movie starring Zac Efron, Kim Basinger, and Charlie Tahan. Charlie's brother, Sam, dies in a car crash that Charlie survives. Charlie is given the gift of seeing his dead brother and others who he has lost...",https://www.imdb.com/video/imdb/vi1333331737,tt1438254,6.4,,Cinemascore,NA
Dinner For Schmucks,Dinner for Schmucks,2010,"Dinner for Schmucks is a movie starring Steve Carell, Paul Rudd, and Stephanie Szostak. When he finds out that his work superiors host a dinner celebrating the idiocy of their guests, a rising executive questions it when he's...",https://www.imdb.com/video/imdb/vi3797747481,tt0427152,5.9,41,Cinemascore,NA
Get Low,Get Low,2010,"Get Low is a movie starring Robert Duvall, Bill Murray, and Sissy Spacek. A movie spun out of equal parts folk tale, fable and real-life legend about the mysterious, 1930s Tennessee hermit who famously threw his own rollicking...",https://www.imdb.com/video/imdb/vi479725081,tt1194263,7.0,85,Cinemascore,NA
Helen,NA,2010,NA,NA,NA,NA,44,Cinemascore,NA
Smash His Camera,Smash His Camera,2010,"Smash His Camera is a movie starring Floyd Abrams, Gilbert M. 'Broncho Billy' Anderson, and Joseph Basile. A film centering on the life and work of Ron Galella that examines the nature and effect of paparazzi.",https://www.imdb.com/video/imdb/vi1643447833,tt1280015,6.9,81,Cinemascore,NA
The Twilight Saga Eclipse,The Twilight Saga: Eclipse,2010,"The Twilight Saga: Eclipse is a movie starring Kristen Stewart, Robert Pattinson, and Taylor Lautner. As a string of mysterious killings grips Seattle, Bella, whose high school graduation is fast approaching, is forced to choose...",https://www.imdb.com/video/imdb/vi2562262553,tt1325004,5.0,48,Cinemascore,NA
Sicilian Girl,La siciliana ribelle,2010,"La siciliana ribelle is a movie starring Veronica D'Agostino, Gérard Jugnot, and Marcello Mazzarella. The true story of 17-year-old Sicilian Rita Atria (Veronica D'Agostino) -- who broke the Sicilian Mafia's code of silence and...",https://www.imdb.com/video/imdb/vi3824354841,tt1213926,6.9,55,Cinemascore,NA
Flipped,Flipped,2010,"Flipped is a movie starring Madeline Carroll, Callan McAuliffe, and Rebecca De Mornay. Two eighth-graders start to have feelings for each other despite being total opposites.",https://www.imdb.com/video/imdb/vi2293302809,tt0817177,7.7,55,Cinemascore,NA
Lebanon,Lebanon,2010,"Lebanon is a movie starring Yoav Donat, Itay Tiran, and Oshri Cohen. During the First Lebanon War in 1982, a lone tank and a paratroopers platoon are dispatched to search a hostile town.",https://www.imdb.com/video/imdb/vi2237466393,tt1483831,6.9,50,Cinemascore,NA
Middle Men,Middle Men,2010,"Middle Men is a movie starring Luke Wilson, Giovanni Ribisi, and Gabriel Macht. Chronicles Jack Harris, one of the pioneers of internet commerce, as he wrestles with his morals, and struggles not to drown in a sea of con men,...",https://www.imdb.com/video/imdb/vi1370687001,tt1251757,6.8,38,Cinemascore,NA
Other Guys,The Other Guys,2010,"The Other Guys is a movie starring Will Ferrell, Mark Wahlberg, and Derek Jeter. Two mismatched New York City detectives seize an opportunity to step up like the city's top cops, whom they idolize, only things don't quite go as...",https://www.imdb.com/video/imdb/vi1253639705,tt1386588,6.6,78,Cinemascore,NA
Step Up 3D,Step Up 3D,2010,"Step Up 3D is a movie starring Sharni Vinson, Rick Malambri, and Adam Sevani. A tight-knit group of New York City street dancers find themselves pitted against the world's best hip hop dancers in a high-stakes showdown.",https://www.imdb.com/video/imdb/vi2734556697,tt1193631,6.2,47,Cinemascore,NA
The Wildest Dream,The Wildest Dream,2010,"The Wildest Dream is a movie starring Conrad Anker, Susan Robertson, and Robert Macfarlane. Uses astonishing visuals to tell the intersecting stories of George Mallory, the first man to attempt a summit of Mount Everest, and Conrad...",https://www.imdb.com/video/imdb/vi1759550233,tt1509276,7.3,77,Cinemascore,NA
Animal Kingdom,Animal Kingdom,2010,"Animal Kingdom is a movie starring James Frecheville, Guy Pearce, and Joel Edgerton. A seventeen year-old navigates his survival amongst an explosive criminal family and the detective who thinks he can save him.",https://www.imdb.com/video/imdb/vi632030745,tt1313092,7.3,95,Cinemascore,NA
Baaria,Baarìa,2010,"Baarìa is a movie starring Francesco Scianna, Margareth Madè, and Lina Sastri. Baaria is Sicilian slang for Bagheria where Tornatore was born and this is an autobiographic epic of three generations in the Sicilian village where he...",https://www.imdb.com/video/imdb/vi1035968281,tt1081935,6.9,,Cinemascore,NA
Scott Pilgrim vs. The World,Scott Pilgrim vs. the World,2010,"Scott Pilgrim vs. the World is a movie starring Michael Cera, Mary Elizabeth Winstead, and Kieran Culkin. Scott Pilgrim must defeat his new girlfriend's seven evil exes in order to win her heart.",https://www.imdb.com/video/imdb/vi1217070617,tt0446029,7.5,,Cinemascore,NA
Tales From Earthsea,NA,2010,NA,NA,NA,NA,43,Cinemascore,NA
The Expendables,The Expendables,2010,"The Expendables is a movie starring Sylvester Stallone, Jason Statham, and Jet Li. A CIA operative hires a team of mercenaries to eliminate a Latin dictator and a renegade CIA agent.",https://www.imdb.com/video/imdb/vi3501000217,tt1320253,6.5,42,Cinemascore,NA
A Film Unfinished,Shtikat Haarchion,2010,"Shtikat Haarchion is a movie starring Alexander Beyer, Rüdiger Vogler, and Hanna Avrutzki. A film about an unfinished film which portrays the people behind and before the camera in the Warsaw Ghetto, exposing the extent of the...",https://www.imdb.com/video/imdb/vi363529753,tt1568923,7.4,97,Cinemascore,NA
Vampires Suck,Vampires Suck,2010,"Vampires Suck is a movie starring Jenn Proske, Matt Lanter, and Diedrich Bader. A spoof of vampire-themed movies. Teenager, Becca finds herself torn between 2 boys. As she and her friends wrestle with a number of different dramas,...",https://www.imdb.com/video/imdb/vi3717727769,tt1666186,3.4,4,Cinemascore,NA
Calvin Marshall,Calvin Marshall,2010,"Calvin Marshall is a movie starring Alex Frost, Noah Scott, and Abbey Merow. A college student is determined to become a Major League Baseball star, but finds his true calling instead.",https://www.imdb.com/video/imdb/vi1495073305,tt0496673,5.9,60,Cinemascore,NA
Lottery Ticket,Lottery Ticket,2010,"Lottery Ticket is a movie starring Shad Moss, Brandon T. Jackson, and Naturi Naughton. Kevin Carson is a young man living in the projects who has to survive a three-day weekend after his opportunistic neighbors find out he's holding...",https://www.imdb.com/video/imdb/vi3383756569,tt0979434,5.0,,Cinemascore,NA
Mao's Last Dancer,Mao's Last Dancer,2010,"Mao's Last Dancer is a movie starring Chi Cao, Bruce Greenwood, and Kyle MacLachlan. In Maoist China, a boy is taken from his family and trained to become a dancer, but everything he knows is challenged when he is chosen to attend a...",https://www.imdb.com/video/imdb/vi138741529,tt1071812,7.3,55,Cinemascore,NA
Nanny McPhee Returns,Nanny McPhee and the Big Bang,2010,"Nanny McPhee and the Big Bang is a movie starring Emma Thompson, Maggie Gyllenhaal, and Ralph Fiennes. Nanny McPhee arrives to help a harried young mother who is trying to run the family farm while her husband is away at war, though...",https://www.imdb.com/video/imdb/vi823789337,tt1415283,6.1,76,Cinemascore,NA
Nanny McPhee Returns,Nanny McPhee and the Big Bang,2010,"Nanny McPhee and the Big Bang is a movie starring Emma Thompson, Maggie Gyllenhaal, and Ralph Fiennes. Nanny McPhee arrives to help a harried young mother who is trying to run the family farm while her husband is away at war, though...",https://www.imdb.com/video/imdb/vi823789337,tt1415283,6.1,76,Cinemascore,NA
Piranha (2010),Piranha 3D,2010,"Piranha 3D is a movie starring Elisabeth Shue, Jerry O'Connell, and Richard Dreyfuss. After a sudden underwater tremor sets free scores of the prehistoric man-eating fish, an unlikely group of strangers must band together to stop...",https://www.imdb.com/video/imdb/vi152241945,tt0464154,5.4,,Cinemascore,NA
Soul Kitchen,Soul Kitchen,2010,"Soul Kitchen is a movie starring Adam Bousdoukos, Moritz Bleibtreu, and Pheline Roggan. In Hamburg, German-Greek chef Zinos unknowingly disturbs the peace in his locals-only restaurant by hiring a more talented chef.",https://www.imdb.com/video/imdb/vi3270837785,tt1244668,7.3,,Cinemascore,NA
The Switch,The Switch,2010,"The Switch is a movie starring Jennifer Aniston, Jason Bateman, and Patrick Wilson. Seven years after the fact, a man comes to the realization that he was the sperm donor for his best friend's boy.",https://www.imdb.com/video/imdb/vi731252249,tt0889573,6.1,,Cinemascore,NA
Tillman Story,The Tillman Story,2010,"The Tillman Story is a movie starring Pat Tillman, Josh Brolin, and Mary Tillman. Pat Tillman never thought of himself as a hero. His choice to leave a multimillion-dollar football contract and join the military wasn't done for any...",https://www.imdb.com/video/imdb/vi1554318873,tt1568334,7.8,,Cinemascore,NA
Centurion,Centurion,2010,"Centurion is a movie starring Michael Fassbender, Dominic West, and Olga Kurylenko. A splinter group of Roman soldiers fight for their lives behind enemy lines after their legion is devastated in a guerrilla attack.",https://www.imdb.com/video/imdb/vi1334445593,tt1020558,6.4,61,Cinemascore,NA
Mesrine Killer Instinct,L'instinct de mort,2010,"L'instinct de mort is a movie starring Vincent Cassel, Cécile de France, and Gérard Depardieu. The story of french gangster Jacques Mesrine, before he was called Public Enemy N°1.",https://www.imdb.com/video/imdb/vi3012298265,tt1259014,7.5,82,Cinemascore,NA
Takers,Takers,2010,"Takers is a movie starring Chris Brown, Hayden Christensen, and Matt Dillon. A group of bank robbers find their multi-million dollar plan interrupted by a hard-boiled detective.",https://www.imdb.com/video/imdb/vi3048801817,tt1135084,6.2,29,Cinemascore,NA
My Dog Tulip,My Dog Tulip,2010,"My Dog Tulip is a movie starring Christopher Plummer, Lynn Redgrave, and Isabella Rossellini. The story of a man who rescues a German shepherd and how the two become fast friends.",https://www.imdb.com/video/imdb/vi417072665,tt0843358,6.9,90,Cinemascore,NA
The American,The American,2010,"The American is a movie starring George Clooney, Paolo Bonacelli, and Violante Placido. An assassin hides out in Italy for one last assignment.",https://www.imdb.com/video/imdb/vi447940121,tt1440728,6.3,65,Cinemascore,NA
A Woman A Gun A Noodle Shop,San qiang pai an jing qi,2010,"San qiang pai an jing qi is a movie starring Dahong Ni, Ni Yan, and Shenyang Xiao. The owner of a Chinese noodle shop's scheme to murder his adulterous wife and her lover goes awry.",https://www.imdb.com/video/imdb/vi4276749849,tt1428556,5.6,,Cinemascore,NA
Going The Distance,Going the Distance,2010,"Going the Distance is a movie starring Drew Barrymore, Justin Long, and Ron Livingston. A romantic comedy centered on a guy and a gal who try to keep their love alive as they shuttle back and forth between New York and San Francisco...",https://www.imdb.com/video/imdb/vi247793177,tt1322312,6.3,,Cinemascore,NA
Last Train Home,Gui tu lie che,2010,"Gui tu lie che is a movie starring Changhua Zhang, Yang Zhang, and Suqin Chen. A couple embarks on a journey home for Chinese new year along with 130 million other migrant workers, to reunite with their children and struggle for a...",https://www.imdb.com/video/imdb/vi2428765209,tt1512201,7.7,,Cinemascore,NA
Mesrine Public Enemy No1,L'instinct de mort,2010,"L'instinct de mort is a movie starring Vincent Cassel, Cécile de France, and Gérard Depardieu. The story of french gangster Jacques Mesrine, before he was called Public Enemy N°1.",https://www.imdb.com/video/imdb/vi3012298265,tt1259014,7.5,,Cinemascore,NA
Noodle,NA,2010,NA,NA,NA,NA,,Cinemascore,NA
Winning Season,The Winning Season,2010,"The Winning Season is a movie starring Sam Rockwell, Emma Roberts, and Rob Corddry. A comedy centered on a has-been coach who is given a shot at redemption when he's asked to run his local high school's girls basketball team.",https://www.imdb.com/video/imdb/vi4091872793,tt1293842,6.6,50,Cinemascore,NA
Ahead Of Time,Ahead of Time: The Extraordinary Journey of Ruth Gruber,2010,"Ahead of Time: The Extraordinary Journey of Ruth Gruber is a movie starring Ruth Gruber, Louisa Herz Leopold, and Dava Sobel. A documentary on the remarkable life of Ruth Gruber. At 97 years old, Brooklyn-born Ruth still has that...",https://www.imdb.com/video/imdb/vi58984729,tt1486548,7.9,90,Cinemascore,NA
Heartbreaker,L'arnacoeur,2010,"L'arnacoeur is a movie starring Romain Duris, Vanessa Paradis, and Julie Ferrier. Alex and his sister run a business designed to break up relationships. They are hired by a rich man to break up the wedding of his daughter. The only...",https://www.imdb.com/video/imdb/vi4276422169,tt1465487,6.7,69,Cinemascore,NA
I'm Still Here,I'm Still Here,2010,"I'm Still Here is a movie starring Joaquin Phoenix, Antony Langdon, and Carey Perloff. Documents Joaquin Phoenix's transition from the acting world to a career as an aspiring rapper.",https://www.imdb.com/video/imdb/vi1742407193,tt1356864,6.2,,Cinemascore,NA
Legendary,Legendary,2010,"Legendary is a movie starring John Cena, Patricia Clarkson, and Danny Glover. A book-smart teenager joins his school's wrestling team as a way to reunite his surviving family members, who split apart after the death of his father, a...",https://www.imdb.com/video/imdb/vi3050374681,tt1563704,6.2,19,Cinemascore,NA
"Lovely, Still","Lovely, Still",2010,"Lovely, Still is a movie starring Martin Landau, Ellen Burstyn, and Elizabeth Banks. A holiday fable that tells the story of an elderly man discovering love for the first time.",https://www.imdb.com/video/imdb/vi1911855897,tt1150947,7.1,71,Cinemascore,NA
Race To Nowhere,Race to Nowhere,2010,NA,https://www.imdb.com/video/imdb/vi3029076249,tt1437364,7.2,71,Cinemascore,NA
Resident Evil Afterlife,Resident Evil: Afterlife,2010,"Resident Evil: Afterlife is a movie starring Milla Jovovich, Ali Larter, and Wentworth Miller. While still out to destroy the evil Umbrella Corporation, Alice joins a group of survivors living in a prison surrounded by the infected...",https://www.imdb.com/video/imdb/vi213583385,tt1220634,5.8,23,Cinemascore,NA
The Romantics,The Romantics,2010,"The Romantics is a movie starring Katie Holmes, Anna Paquin, and Josh Duhamel. Seven close friends reunite for the wedding of two of their friends. Problems arise because the bride and the maid of honor have had a long rivalry over...",https://www.imdb.com/video/imdb/vi3617982745,tt1403988,5.1,14,Cinemascore,NA
Never Let Me Go,Never Let Me Go,2010,"Never Let Me Go is a movie starring Keira Knightley, Carey Mulligan, and Andrew Garfield. The lives of three friends, from their early school days into young adulthood, when the reality of the world they live in comes knocking.",https://www.imdb.com/video/imdb/vi1723008537,tt1334260,7.1,,Cinemascore,NA
Alpha and Omega,Alpha and Omega,2010,"Alpha and Omega is a movie starring Hayden Panettiere, Christina Ricci, and Justin Long. Two young wolves at opposite ends of their pack's social order are thrown together into a foreign land and need each other to return home, but...",https://www.imdb.com/video/imdb/vi3345090329,tt1213012,5.2,16,Cinemascore,NA
Catfish,Catfish,2010,"Catfish is a movie starring Nev Schulman, Ariel Schulman, and Henry Joost. Young filmmakers document their colleague's budding online friendship with a young woman and her family which leads to an unexpected series of discoveries.",https://www.imdb.com/video/imdb/vi769787417,tt1584016,7.1,80,Cinemascore,NA
Easy A,Easy A,2010,"Easy A is a movie starring Emma Stone, Amanda Bynes, and Penn Badgley. A clean-cut high school student relies on the school's rumor mill to advance her social and financial standing.",https://www.imdb.com/video/imdb/vi1057359641,tt1282140,7.1,85,Cinemascore,NA
Jack Goes Boating,Jack Goes Boating,2010,"Jack Goes Boating is a movie starring Philip Seymour Hoffman, Amy Ryan, and John Ortiz. A limo driver's blind date sparks a tale of love, betrayal, friendship, and grace centered around two working-class New York City couples.",https://www.imdb.com/video/imdb/vi2191459865,tt1278379,6.4,68,Cinemascore,NA
Leaves Of Grass,Leaves of Grass,2010,"Leaves of Grass is a movie starring Edward Norton, Keri Russell, and Henry Max Nelson. An Ivy League professor is lured back to his Oklahoma hometown, where his twin brother, a small-time pot grower, has concocted a scheme to take...",https://www.imdb.com/video/imdb/vi68289561,tt1151359,6.4,,Cinemascore,NA
The Freebie,The Freebie,2010,"The Freebie is a movie starring Katie Aselton, Dax Shepard, and Maggie Phillips. A young couple decides to give each other a night off, no questions asked.",https://www.imdb.com/video/imdb/vi1235290393,tt1474889,5.1,57,Cinemascore,NA
Undertow,Contracorriente,2010,"Contracorriente is a movie starring Cristian Mercado, Tatiana Astengo, and Manolo Cardona. An unusual ghost story set on the Peruvian seaside; a married fisherman struggles to reconcile his devotion to his male lover within his...",https://www.imdb.com/video/imdb/vi606471193,tt1368491,7.8,,Cinemascore,NA
You Will Meet A Tall Dark Stranger,You Will Meet a Tall Dark Stranger,2010,"You Will Meet a Tall Dark Stranger is a movie starring Anthony Hopkins, Naomi Watts, and Josh Brolin. Sally's parents' marriage breaks up when her father undergoes a mid-life crisis and impulsively weds a prostitute. Meanwhile,...",https://www.imdb.com/video/imdb/vi2180384281,tt1182350,6.3,45,Cinemascore,NA
Buried,Buried,2010,"Buried is a movie starring Ryan Reynolds, José Luis García Pérez, and Robert Paterson. Paul is a U.S. truck driver working in Iraq. After an attack by a group of Iraqis he wakes to find he is buried alive inside a coffin. With only...",https://www.imdb.com/video/imdb/vi1000212761,tt1462758,7.0,86,Cinemascore,NA
Enter The Void,Enter the Void,2010,"Enter the Void is a movie starring Nathaniel Brown, Paz de la Huerta, and Cyril Roy. A French drug dealer living in Tokyo is betrayed by his best friend and killed in a drug deal. His soul, observing the repercussions of his death,...",https://www.imdb.com/video/imdb/vi2532115993,tt1191111,7.3,71,Cinemascore,NA
Howl,NA,2010,NA,NA,NA,NA,62,Cinemascore,NA
Like Dandelion Dust,Like Dandelion Dust,2010,"Like Dandelion Dust is a movie starring Mira Sorvino, Barry Pepper, and Cole Hauser. A compelling drama that explores the different meanings of being a parent through the gritty, realistic lives of the struggling, blue-collar...",https://www.imdb.com/video/imdb/vi3706193433,tt0981042,7.0,82,Cinemascore,NA
Virginity Hit,The Virginity Hit,2010,"The Virginity Hit is a movie starring Matt Bennett, Zack Pearlman, and Krysta Rodriguez. Four guys, one camera, and their experience chronicling the exhilarating and terrifying rite of passage: losing your virginity. As these guys...",https://www.imdb.com/video/imdb/vi3453027865,tt1695994,4.6,,Cinemascore,NA
Waiting For Superman,Waiting for 'Superman',2010,"Waiting for 'Superman' is a movie starring Charles Adam, Charles Adams, and Jonathan Alter. An examination of the current state of education in America today.",https://www.imdb.com/video/imdb/vi2518550297,tt1566648,7.5,90,Cinemascore,NA
Wall Street 2,Wall Street: Money Never Sleeps,2010,"Wall Street: Money Never Sleeps is a movie starring Shia LaBeouf, Michael Douglas, and Carey Mulligan. Now out of prison but still disgraced by his peers, Gordon Gekko works his future son-in-law, an idealistic stock broker, when he...",https://www.imdb.com/video/imdb/vi875627545,tt1027718,6.2,,Cinemascore,NA
You Again,You Again,2010,"You Again is a movie starring Kristen Bell, Odette Annable, and Sigourney Weaver. When a young woman realizes her brother is about to marry the girl who bullied her in high school, she sets out to expose the fiancée's true colors.",https://www.imdb.com/video/imdb/vi3615885593,tt1414382,5.8,17,Cinemascore,NA
Barry Munday,Barry Munday,2010,"Barry Munday is a movie starring Patrick Wilson, Judy Greer, and Chloë Sevigny. Barry Munday wakes up after being attacked to realize that he's missing his family jewels. To make matters worse, he learns he's facing a paternity...",https://www.imdb.com/video/imdb/vi4092200473,tt0482461,5.9,43,Cinemascore,NA
Case 39,Case 39,2010,"Case 39 is a movie starring Renée Zellweger, Ian McShane, and Jodelle Ferland. A social worker fights to save a girl from her abusive parents, only to discover that the situation is more dangerous than she ever expected.",https://www.imdb.com/video/imdb/vi4192142873,tt0795351,6.2,21,Cinemascore,NA
Freakonomics,Freakonomics,2010,"Freakonomics is a movie starring James Ransone, Morgan Spurlock, and Tempestt Bledsoe. A collection of documentaries that explores the hidden side of human nature through the use of the science of economics.",https://www.imdb.com/video/imdb/vi3806004761,tt1152822,6.4,66,Cinemascore,NA
Hatchet,Hatchet II,2010,"Hatchet II is a movie starring Danielle Harris, Kane Hodder, and Tony Todd. Marybeth escapes the clutches of the bayou-butcher Victor Crowley and returns to the swamp with an army of hunters and gunmen, determined to end Crowley's...",https://www.imdb.com/video/imdb/vi4156950041,tt1270835,5.5,52,Cinemascore,NA
Hatchet 2,Hatchet II,2010,"Hatchet II is a movie starring Danielle Harris, Kane Hodder, and Tony Todd. Marybeth escapes the clutches of the bayou-butcher Victor Crowley and returns to the swamp with an army of hunters and gunmen, determined to end Crowley's...",https://www.imdb.com/video/imdb/vi4156950041,tt1270835,5.5,,Cinemascore,NA
Let Me In,Let Me In,2010,"Let Me In is a movie starring Kodi Smit-McPhee, Chloë Grace Moretz, and Richard Jenkins. A bullied young boy befriends a young female vampire who lives in secrecy with her guardian.",https://www.imdb.com/video/imdb/vi4152756505,tt1228987,7.1,88,Cinemascore,NA
The Social Network,The Social Network,2010,"The Social Network is a movie starring Jesse Eisenberg, Andrew Garfield, and Justin Timberlake. As Harvard student Mark Zuckerberg creates the social networking site that would become known as Facebook, he is sued by the twins who...",https://www.imdb.com/video/imdb/vi4152690201,tt1285016,7.7,96,Cinemascore,NA
As Good As Dead,As Good as Dead,2010,"As Good as Dead is a movie starring Andie MacDowell, Cary Elwes, and Frank Whaley. Seeking revenge for the murder of their religious leader, fundamental loyalists kidnap and torture the man they believe responsible, but the ensuing...",https://www.imdb.com/video/imdb/vi4015064345,tt1294136,5.2,,Cinemascore,NA
Cherry,About Cherry,2010,"About Cherry is a movie starring Ashley Hinshaw, James Franco, and Heather Graham. A troubled young woman moves to San Francisco, where she becomes involved in pornography and aligns herself with a cocaine-addicted lawyer.",https://www.imdb.com/video/imdb/vi3959268633,tt1945062,4.8,,Cinemascore,NA
Inside Job,Inside Job,2010,"Inside Job is a movie starring Matt Damon, Gylfi Zoega, and Andri Snær Magnason. Takes a closer look at what brought about the 2008 financial meltdown.",https://www.imdb.com/video/imdb/vi751502873,tt1645089,8.2,98,Cinemascore,NA
It's Kind Of A Funny Story,It's Kind of a Funny Story,2010,"It's Kind of a Funny Story is a movie starring Keir Gilchrist, Zach Galifianakis, and Emma Roberts. A clinically depressed teenager gets a new start after he checks himself into an adult psychiatric ward.",https://www.imdb.com/video/imdb/vi2743862809,tt0804497,7.1,58,Cinemascore,NA
