movie name,imdb name,year,description,trailer link,movie id,imdb score,rotten score,cinema score,user score
Hot Rod,Hot Rod,2007,"Hot Rod is a movie starring Andy Samberg, Isla Fisher, and Ian McShane. Self-proclaimed stuntman Rod Kimble is preparing for the jump of his life - to clear fifteen buses to raise money for his abusive stepfather Frank's life-saving...",https://www.imdb.com/video/imdb/vi994246681,tt0787475,6.7,39,Cinemascore,NA
The Bourne Ultimatum,The Bourne Ultimatum,2007,"The Bourne Ultimatum is a movie starring Matt Damon, Edgar Ramírez, and Joan Allen. Jason Bourne dodges a ruthless C.I.A. official and his Agents from a new assassination program while searching for the origins of his life as a...",NA,tt0440963,8.0,,Cinemascore,NA
Daddy Day Camp,Daddy Day Camp,2007,"Daddy Day Camp is a movie starring Cuba Gooding Jr., Lochlyn Munro, and Richard Gant. Seeking to offer his son the satisfying summer camp experience that eluded him as a child, the operator of a neighborhood daycare center opens his...",https://www.imdb.com/video/imdb/vi1285554457,tt0462244,3.1,1,Cinemascore,NA
2 Days In Paris,2 Days in Paris,2007,"2 Days in Paris is a movie starring Julie Delpy, Adam Goldberg, and Daniel Brühl. Marion and Jack try to rekindle their relationship with a visit to Paris, home of Marion's parents -- and several of her ex-boyfriends.",https://www.imdb.com/video/imdb/vi2830303513,tt0841044,6.8,87,Cinemascore,NA
Cut Sleeve Boys,Cut Sleeve Boys,2007,"Cut Sleeve Boys is a movie starring Chowee Leow, Steven Lim, and Gareth Rhys Davis. Two British Chinese gay men decides to re-examine their lives following a death of their friend. Mel sleeps around whilst rejecting the love of Todd...",NA,tt0461760,6.1,45,Cinemascore,NA
Rocket Science,Rocket Science,2007,"Rocket Science is a movie starring Reece Thompson, Anna Kendrick, and Nicholas D'Agosto. Looking for answers to life's big questions, a stuttering boy joins his high school debate team.",https://www.imdb.com/video/imdb/vi4288610585,tt0477078,6.6,84,Cinemascore,NA
Rush Hour 3,Rush Hour 3,2007,"Rush Hour 3 is a movie starring Jackie Chan, Chris Tucker, and Max von Sydow. After an attempted assassination on Ambassador Han, Lee and Carter head to Paris to protect a French woman with knowledge of the Triads' secret leaders.",https://www.imdb.com/video/imdb/vi629473561,tt0293564,6.2,18,Cinemascore,NA
Skinwalkers,Skinwalkers,2007,"Skinwalkers is a movie starring Jason Behr, Elias Koteas, and Rhona Mitra. A 12 year old boy and his mother become the targets of two warring werewolf packs, each with different intentions and motives.",https://www.imdb.com/video/imdb/vi3632464153,tt0461703,4.6,13,Cinemascore,NA
Stardust,Stardust,2007,"Stardust is a movie starring Charlie Cox, Claire Danes, and Sienna Miller. In a countryside town bordering on a magical land, a young man makes a promise to his beloved that he'll retrieve a fallen star by venturing into the magical...",https://www.imdb.com/video/imdb/vi4018471193,tt0486655,7.6,76,Cinemascore,NA
The Descent,The Descent,2007,"The Descent is a movie starring Shauna Macdonald, Natalie Mendoza, and Alex Reid. A caving expedition goes horribly wrong, as the explorers become trapped and ultimately pursued by a strange breed of predators.",https://www.imdb.com/video/imdb/vi2810904857,tt0435625,7.2,85,Cinemascore,NA
11th Hour,The 11th Hour,2007,"The 11th Hour is a movie starring Leonardo DiCaprio, Kenny Ausubel, and Thom Hartmann. A look at the state of the global environment including visionary and practical solutions for restoring the planet's ecosystems.",https://www.imdb.com/video/imdb/vi932053273,tt0492931,7.3,67,Cinemascore,NA
Superbad,Superbad,2007,"Superbad is a movie starring Michael Cera, Jonah Hill, and Christopher Mintz-Plasse. Two co-dependent high school seniors are forced to deal with separation anxiety after their plan to stage a booze-soaked party goes awry.",https://www.imdb.com/video/imdb/vi1602730521,tt0829482,7.6,87,Cinemascore,NA
The Invasion,The Invasion,2007,"The Invasion is a movie starring Nicole Kidman, Daniel Craig, and Jeremy Northam. As a Washington, D.C. psychiatrist unearths the origin of an alien epidemic, she also discovers her son might be the only way it can be stopped.",https://www.imdb.com/video/imdb/vi1727267097,tt0427392,5.9,19,Cinemascore,NA
The King Of Kong,The King of Kong,2007,"The King of Kong is a movie starring Steve Wiebe, Billy Mitchell, and Mark Alpiger. Die-hard gamers compete to break world records on classic arcade games.",https://www.imdb.com/video/imdb/vi3774087449,tt0923752,8.1,97,Cinemascore,NA
The Last Legion,The Last Legion,2007,"The Last Legion is a movie starring Colin Firth, Ben Kingsley, and Aishwarya Rai Bachchan. As the Roman empire crumbles, young Romulus Augustus flees the city and embarks on a perilous voyage to Britain to track down a legion of...",https://www.imdb.com/video/imdb/vi2599747865,tt0462396,5.4,,Cinemascore,NA
Hannah Takes The Stairs,Hannah Takes the Stairs,2007,"Hannah Takes the Stairs is a movie starring Greta Gerwig, Kent Osborne, and Andrew Bujalski. Hannah is a recent college graduate interning at a Chicago production company. She is crushing on two writers at work, Matt and Paul, who...",https://www.imdb.com/video/imdb/vi3752198425,tt0841108,5.6,59,Cinemascore,NA
Closing Escrow,Closing Escrow,2007,"Closing Escrow is a movie starring Wendi McLendon-Covey, Ryan Smith, and Bruce Thomas. Three quirky families seeking to buy their next home collide when trying to purchase the same property. The bidding war tests the limits of their...",NA,tt0473015,5.4,,Cinemascore,NA
Dedication,Dedication,2007,"Dedication is a movie starring Billy Crudup, Mandy Moore, and Tom Wilkinson. The romantic comedy follows a misogynistic children's book author who is forced to work closely with a female illustrator instead of his long-time...",https://www.imdb.com/video/imdb/vi1889599769,tt0490579,6.7,40,Cinemascore,NA
Eye Of The Dolphin,Eye of the Dolphin,2007,"Eye of the Dolphin is a movie starring Carly Schroeder, Adrian Dunbar, and George Harris. A young girl discovers she can communicate with dolphins.",https://www.imdb.com/video/imdb/vi145096985,tt0465407,5.7,29,Cinemascore,NA
Illegal Tender,Illegal Tender,2007,"Illegal Tender is a movie starring Rick Gonzalez, Wanda De Jesus, and Dania Ramirez. When the thugs who killed his father come looking for him, a young Latino man and his mother flee from their home.",https://www.imdb.com/video/imdb/vi1284571417,tt0775488,5.5,15,Cinemascore,NA
Mr. Bean's Holiday,Mr. Bean's Holiday,2007,"Mr. Bean's Holiday is a movie starring Rowan Atkinson, Willem Dafoe, and Steve Pemberton. Mr. Bean wins a trip to Cannes where he unwittingly separates a young boy from his father and must help the two come back together. On the way...",NA,tt0453451,6.4,,Cinemascore,NA
Resurrecting The Champ,Resurrecting the Champ,2007,"Resurrecting the Champ is a movie starring Samuel L. Jackson, Josh Hartnett, and Kathryn Morris. Up-and-coming sports reporter rescues a homeless man (""Champ"") only to discover that he is, in fact, a boxing legend believed to have...",https://www.imdb.com/video/imdb/vi1168048409,tt0416185,6.7,60,Cinemascore,NA
Right At Your Door,Right at Your Door,2007,"Right at Your Door is a movie starring Mary McCormack, Rory Cochrane, and Tony Perez. A dirty bomb goes off in Los Angeles, jamming freeways and spreading a toxic cloud.",https://www.imdb.com/video/imdb/vi2376007961,tt0458367,6.1,68,Cinemascore,NA
September Dawn,September Dawn,2007,"September Dawn is a movie starring Jon Voight, Trent Ford, and Tamara Hope. A love story set during a tense encounter between a wagon train of settlers and a renegade Mormon group.",https://www.imdb.com/video/imdb/vi3264282905,tt0473700,5.8,15,Cinemascore,NA
The Hottest State,The Hottest State,2007,"The Hottest State is a movie starring Mark Webber, Catalina Sandino Moreno, and Laura Linney. A young actor from Texas tries to make it in New York while struggling in his relationship with a beautiful singer/songwriter.",https://www.imdb.com/video/imdb/vi485753113,tt0496319,6.1,,Cinemascore,NA
The Nanny Diaries,The Nanny Diaries,2007,"The Nanny Diaries is a movie starring Scarlett Johansson, Laura Linney, and Paul Giamatti. A college graduate goes to work as a nanny for a rich New York family. Ensconced in their home, she has to juggle their dysfunction, a new...",https://www.imdb.com/video/imdb/vi1358364953,tt0489237,6.2,,Cinemascore,NA
Balls of Fury,Balls of Fury,2007,"Balls of Fury is a movie starring Dan Fogler, Christopher Walken, and George Lopez. Down-and-out former professional ping-pong phenom, Randy Daytona, is sucked into a maelstrom when FBI Agent Ernie Rodriguez recruits him for a...",https://www.imdb.com/video/imdb/vi2696413465,tt0424823,5.3,22,Cinemascore,NA
Death Sentence,Death Sentence,2007,"Death Sentence is a movie starring Kevin Bacon, John Goodman, and Kelly Preston. Nick Hume is a mild-mannered executive with a perfect life, until one gruesome night he witnesses something that changes him forever. Transformed by...",https://www.imdb.com/video/imdb/vi1537278233,tt0804461,6.8,21,Cinemascore,NA
Exiled,Fong juk,2007,"Fong juk is a movie starring Nick Cheung, Anthony Chau-Sang Wong, and Francis Ng. A friendship is formed between an ex-gangster, and two groups of hitmen - those who want to protect him and those who were sent to kill him.",https://www.imdb.com/video/imdb/vi3785687321,tt0796212,7.3,80,Cinemascore,NA
Ladron Que Roba A Ladron,Ladrón que roba a ladrón,2007,"Ladrón que roba a ladrón is a movie starring Fernando Colunga, Miguel Varoni, and Julie Gonzalo. Two former thieves reunite to rob the biggest thief they know -- Moctesuma Valdez, a TV infomercial guru who's made millions selling...",NA,tt0859760,6.8,,Cinemascore,NA
Self Medicated,Self Medicated,2007,"Self Medicated is a movie starring Monty Lapica, Diane Venora, and Michael Bowen. A pill-popping mom has her drug-abusing teen son abducted into a private intervention facility that means well.",https://www.imdb.com/video/imdb/vi3728738073,tt0341569,5.7,36,Cinemascore,NA
I Want Someone To Eat Cheese With,I Want Someone to Eat Cheese With,2007,"I Want Someone to Eat Cheese With is a movie starring Jeff Garlin, Sarah Silverman, and Bonnie Hunt. About a man who has trouble with his job, trouble with women, and uses food to deal with it all.",https://www.imdb.com/video/imdb/vi111673625,tt0391229,6.1,73,Cinemascore,NA
3:10 To Yuma,3:10 to Yuma,2007,"3:10 to Yuma is a movie starring Russell Crowe, Christian Bale, and Ben Foster. A small-time rancher agrees to hold a captured outlaw who's awaiting a train to go to court in Yuma. A battle of wills ensues as the outlaw tries to...",https://www.imdb.com/video/imdb/vi2880504089,tt0381849,7.7,89,Cinemascore,NA
Fierce People,Fierce People,2007,"Fierce People is a movie starring Diane Lane, Donald Sutherland, and Anton Yelchin. A massage therapist looking to overcome her addictions and reconnect with her son, whose father is an anthropologist in South America studying the...",https://www.imdb.com/video/imdb/vi2401740313,tt0401420,6.5,24,Cinemascore,NA
In The Shadow Of The Moon,In the Shadow of the Moon,2007,"In the Shadow of the Moon is a movie starring Buzz Aldrin, Neil Armstrong, and Stephen Armstrong. The crew members of NASA's Apollo missions tell their story in their own words.",https://www.imdb.com/video/imdb/vi3666936089,tt0925248,8.0,64,Cinemascore,NA
Romance And Cigarettes,Romance & Cigarettes,2007,"Romance & Cigarettes is a movie starring James Gandolfini, Susan Sarandon, and Kate Winslet. A down-and-dirty musical set in the world of working-class New York, tells a story of a husband's journey into infidelity and redemption...",https://www.imdb.com/video/imdb/vi4103078169,tt0368222,6.3,54,Cinemascore,NA
Shoot Em Up,Shoot 'Em Up,2007,"Shoot 'Em Up is a movie starring Clive Owen, Monica Bellucci, and Paul Giamatti. A man named Mr. Smith delivers a woman's baby during a shootout, and is then called upon to protect the newborn from the army of gunmen.",https://www.imdb.com/video/imdb/vi2256994585,tt0465602,6.7,67,Cinemascore,NA
The Brothers Solomon,The Brothers Solomon,2007,"The Brothers Solomon is a movie starring Will Arnett, Will Forte, and Jenna Fischer. A pair of well-meaning, but socially inept brothers try to find their perfect mates in order to provide their dying father with a grandchild.",https://www.imdb.com/video/imdb/vi3935240473,tt0784972,5.3,,Cinemascore,NA
The Bubble,Ha-Buah,2007,"Ha-Buah is a movie starring Ohad Knoller, Yousef 'Joe' Sweid, and Daniella Wircer. The movie follows a group of young friends in the city of Tel Aviv and is as much a love song to the city as it is an exploration of the claim that...",NA,tt0476643,7.3,,Cinemascore,NA
The Hunting Party,The Hunting Party,2007,"The Hunting Party is a movie starring Richard Gere, Terrence Howard, and Jesse Eisenberg. A young journalist, a seasoned cameraman and a discredited war correspondent embark on an unauthorized mission to find the No.1 war criminal...",https://www.imdb.com/video/imdb/vi1039401241,tt0455782,6.8,,Cinemascore,NA
The Inner Life Of Martin Frost,The Inner Life of Martin Frost,2007,"The Inner Life of Martin Frost is a movie starring David Thewlis, Irène Jacob, and Michael Imperioli. Internationally acclaimed novelist Paul Auster (""New York Trilogy"", ""The Book of Illusions"", ""Man in the Dark"") explores the art...",NA,tt0479074,5.1,,Cinemascore,NA
The Unknown Soldier,Der unbekannte Soldat,2007,NA,NA,tt0844462,7.5,,Cinemascore,NA
Across The Universe,Across the Universe,2007,"Across the Universe is a movie starring Evan Rachel Wood, Jim Sturgess, and Joe Anderson. The music of The Beatles and the Vietnam War form the backdrop for the romance between an upper-class American girl and a poor Liverpudlian...",https://www.imdb.com/video/imdb/vi95748377,tt0445922,7.4,,Cinemascore,NA
December Boys,December Boys,2007,"December Boys is a movie starring Daniel Radcliffe, Teresa Palmer, and Lee Cormie. One summer, four orphans boys who have grown to be the closest of friends find themselves competing for the attention of the same family.",https://www.imdb.com/video/imdb/vi1117847833,tt0465436,6.5,41,Cinemascore,NA
Eastern Promises,Eastern Promises,2007,"Eastern Promises is a movie starring Naomi Watts, Viggo Mortensen, and Armin Mueller-Stahl. A Russian teenager living in London who dies during childbirth leaves clues to a midwife in her journal that could tie her child to a rape...",https://www.imdb.com/video/imdb/vi2947612953,tt0765443,7.6,89,Cinemascore,NA
Great World Of Sound,Great World of Sound,2007,"Great World of Sound is a movie starring Pat Healy, Kene Holiday, and John Baker. When a man answers an advertisement to train as a record producer, he's excited by the prospect of signing undiscovered musicians, only to discover...",https://www.imdb.com/video/imdb/vi782958873,tt0826547,6.8,81,Cinemascore,NA
Homecoming,NA,2007,NA,NA,NA,NA,,Cinemascore,NA
In The Valley Of Elah,In the Valley of Elah,2007,"In the Valley of Elah is a movie starring Tommy Lee Jones, Charlize Theron, and Jonathan Tucker. A retired military investigator works with a police detective to uncover the truth behind his son's disappearance following his return...",https://www.imdb.com/video/imdb/vi3583050009,tt0478134,7.1,73,Cinemascore,NA
Ira And Abby,Ira & Abby,2007,"Ira & Abby is a movie starring Jennifer Westfeldt, Chris Messina, and Jason Alexander. A hastily married couple quickly devolve into a life of affairs, meddling parents, and therapy.",NA,tt0480251,6.5,68,Cinemascore,NA
King of California,King of California,2007,"King of California is a movie starring Michael Douglas, Evan Rachel Wood, and Willis Burks II. An unstable dad who after getting out of a mental institution tries to convince his daughter that there's Spanish gold buried somewhere...",https://www.imdb.com/video/imdb/vi2763063577,tt0388182,6.6,63,Cinemascore,NA
Moving McAllister,Moving McAllister,2007,"Moving McAllister is a movie starring Benjamin Gourley, Mila Kunis, and Jon Heder. Rick Robinson is a ladder-climbing law intern from Miami with four days until the Bar Exam. Desperate to score points with his boss (McAllister), he...",https://www.imdb.com/video/imdb/vi463143193,tt0444672,5.3,10,Cinemascore,NA
Mr. Woodcock,Mr. Woodcock,2007,"Mr. Woodcock is a movie starring Billy Bob Thornton, Seann William Scott, and Susan Sarandon. Taken aback by his mother's wedding announcement, a young man returns home in an effort to stop her from marrying his old high school gym...",https://www.imdb.com/video/imdb/vi3685810457,tt0419984,5.1,,Cinemascore,NA
Silk,Silk,2007,"Silk is a movie starring Michael Pitt, Keira Knightley, and Kôji Yakusho. The story of a married silkworm merchant-turned-smuggler in 19th century France traveling to Japan for his town's supply of silkworms after a disease wipes...",https://www.imdb.com/video/imdb/vi1502085401,tt0494834,5.9,,Cinemascore,NA
The Brave One,The Brave One,2007,"The Brave One is a movie starring Jodie Foster, Terrence Howard, and Naveen Andrews. Struggling to recover emotionally from a brutal assault that killed her fiancé and left her in a coma, a radio personality begins a quest for...",https://www.imdb.com/video/imdb/vi2209415449,tt0476964,6.7,43,Cinemascore,NA
Toots,NA,2007,NA,NA,NA,NA,,Cinemascore,NA
Last Winter,The Last Winter,2007,"The Last Winter is a movie starring Ron Perlman, James Le Gros, and Connie Britton. The American oil company North Corporation is building an ice road to explore the remote Northern Arctic National Wildlife Refuge seeking oil. The...",https://www.imdb.com/video/imdb/vi3618701593,tt0454864,5.6,76,Cinemascore,NA
Good Luck Chuck,Good Luck Chuck,2007,"Good Luck Chuck is a movie starring Dane Cook, Jessica Alba, and Dan Fogler. In order to keep the woman of his dreams from falling for another guy, Charlie Logan has to break the curse that has made him wildly popular with single...",https://www.imdb.com/video/imdb/vi2981167385,tt0452625,5.6,5,Cinemascore,NA
Into The Wild,Into the Wild,2007,"Into the Wild is a movie starring Emile Hirsch, Vince Vaughn, and Catherine Keener. After graduating from Emory University, top student and athlete Christopher McCandless abandons his possessions, gives his entire $24,000 savings...",https://www.imdb.com/video/imdb/vi1051656473,tt0758758,8.1,83,Cinemascore,NA
Randy And The Mob,Randy and the Mob,2007,"Randy and the Mob is a movie starring Ray McKinnon, Walton Goggins, and Lisa Blount. A good ol' boy (McKinnon) gets into trouble with some mobsters, and then must seek assistance from his estranged, identical twin gay brother.",https://www.imdb.com/video/imdb/vi3819897113,tt0466943,5.9,,Cinemascore,NA
Resident Evil 3,Resident Evil: Extinction,2007,"Resident Evil: Extinction is a movie starring Milla Jovovich, Ali Larter, and Oded Fehr. Survivors of the Raccoon City catastrophe travel across the Nevada desert, hoping to make it to Alaska. Alice joins the caravan and their fight...",https://www.imdb.com/video/imdb/vi3364028697,tt0432021,6.3,,Cinemascore,NA
Sea of Dreams,Sea of Dreams,2007,"Sea of Dreams is a movie starring Johnathon Schaech, Sendi Bar, and Angélica María. On an island across the sea lies a village full of romance, wonder and mystery; a timeless place where people carry strong beliefs that can fulfill...",https://www.imdb.com/video/imdb/vi1990984217,tt0367567,6.3,,Cinemascore,NA
Sydney White,Sydney White,2007,"Sydney White is a movie starring Amanda Bynes, Sara Paxton, and Matt Long. A modern retelling of Snow White set against students in their freshman year of college in the greek system.",https://www.imdb.com/video/imdb/vi3752919321,tt0815244,6.2,36,Cinemascore,NA
The Assassination of Jesse James by the Coward Robert Ford,The Assassination of Jesse James by the Coward Robert Ford,2007,"The Assassination of Jesse James by the Coward Robert Ford is a movie starring Brad Pitt, Casey Affleck, and Sam Shepard. Robert Ford, who's idolized Jesse James since childhood, tries hard to join the reforming gang of the Missouri...",https://www.imdb.com/video/imdb/vi2897281305,tt0443680,7.5,,Cinemascore,NA
The Jane Austen Book Club,The Jane Austen Book Club,2007,"The Jane Austen Book Club is a movie starring Kathy Baker, Hugh Dancy, and Amy Brenneman. Six Californians start a club to discuss the works of Jane Austen, only to find their relationships -- both old and new -- begin to resemble...",https://www.imdb.com/video/imdb/vi3673424153,tt0866437,6.8,,Cinemascore,NA
Feast,Feast,2007,"Feast is a movie starring Navi Rawat, Krista Allen, and Balthazar Getty. Patrons locked inside a bar are forced to fight monsters.",https://www.imdb.com/video/imdb/vi3500540185,tt0426459,6.3,57,Cinemascore,NA
Feast of Love,Feast of Love,2007,"Feast of Love is a movie starring Morgan Freeman, Radha Mitchell, and Alexa Davalos. A meditation on love and its various incarnations, set within a community of friends in Oregon. and is described as an exploration of the magical,...",https://www.imdb.com/video/imdb/vi128255257,tt0800027,6.6,40,Cinemascore,NA
Itty Bitty Titty Committee,Itty Bitty Titty Committee,2007,"Itty Bitty Titty Committee is a movie starring Melonie Diaz, Ana Mercedes, and Cecile Rivore. High School grad and all American gal, Anna, finds her purpose and herself after she hooks up with the radical feminists in The Itty Bitty...",https://www.imdb.com/video/imdb/vi1077543705,tt0496328,5.5,,Cinemascore,NA
Outsourced,Outsourced,2007,"Outsourced is a movie starring Josh Hamilton, Ayesha Dharker, and Asif Basra. After his entire department is outsourced, an American novelty products salesman (Hamilton) heads to India to train his replacement.",NA,tt0425326,7.0,76,Cinemascore,NA
Sharkwater,Sharkwater,2007,"Sharkwater is a movie starring Rob Stewart, Paul Watson, and Erich Ritter. An investigation of sharks' importance to ecosystems and humankind's mass destruction of shark species worldwide.",https://www.imdb.com/video/imdb/vi2122776857,tt0856008,8.0,79,Cinemascore,NA
The Game Plan,The Game Plan,2007,"The Game Plan is a movie starring Dwayne Johnson, Kyra Sedgwick, and Madison Pettis. An NFL quarterback living the bachelor lifestyle discovers that he has an 8-year-old daughter from a previous relationship.",https://www.imdb.com/video/imdb/vi2649621529,tt0492956,6.1,,Cinemascore,NA
The Kingdom Movie,Disaster Movie,2007,"Disaster Movie is a movie starring Carmen Electra, Vanessa Lachey, and Nicole Parker. Over the course of one evening, an unsuspecting group of twenty-somethings find themselves bombarded by a series of natural disasters and...",https://www.imdb.com/video/imdb/vi1211761433,tt1213644,1.9,,Cinemascore,NA
The Darjeeling Limited,The Darjeeling Limited,2007,"The Darjeeling Limited is a movie starring Owen Wilson, Adrien Brody, and Jason Schwartzman. A year after their father's funeral, three brothers travel across India by train in an attempt to bond with each other.",https://www.imdb.com/video/imdb/vi4092592409,tt0838221,7.2,,Cinemascore,NA
Lake Of Fire,Lake of Fire,2007,"Lake of Fire is a movie starring Noam Chomsky, Bill Baird, and Flip Benham. A graphic documentary on both sides of the abortion debate.",https://www.imdb.com/video/imdb/vi1586823449,tt0841119,8.2,,Cinemascore,NA
Feel The Noise,Feel the Noise,2007,"Feel the Noise is a movie starring Omarion, Giancarlo Esposito, and Melonie Diaz. A young man from the South Bronx dreams of making it as a rapper, until a run-in with local thugs forces him to hide in Puerto Rico with the father he...",https://www.imdb.com/video/imdb/vi215811609,tt0756703,2.9,12,Cinemascore,NA
For The Bible Tells Me So,For the Bible Tells Me So,2007,"For the Bible Tells Me So is a movie starring Imogene Robinson, Victor Robinson, and Gene Robinson. An exploration of the intersection between religion and homosexuality in the U.S. and how the religious right has used its...",https://www.imdb.com/video/imdb/vi363331865,tt0912583,7.8,98,Cinemascore,NA
Michael Clayton,Michael Clayton,2007,"Michael Clayton is a movie starring George Clooney, Tilda Swinton, and Tom Wilkinson. A law firm brings in its ""fixer"" to remedy the situation after a lawyer has a breakdown while representing a chemical company that he knows is...",https://www.imdb.com/video/imdb/vi2795045145,tt0465538,7.2,90,Cinemascore,NA
My Kid Could Paint That,My Kid Could Paint That,2007,"My Kid Could Paint That is a movie starring Marla Olmstead, Laura Olmstead, and Mark Olmstead. A look at the work and surprising success of a four-year-old girl whose paintings have been compared to the likes of Picasso and has...",https://www.imdb.com/video/imdb/vi3281715481,tt0912592,7.1,94,Cinemascore,NA
Skid Marks,Skid Marks,2007,"Skid Marks is a movie starring Tyler Poelle, Mikey Post, and Scott Dittman. Budget cuts force two rival ambulance companies and their misfit medics to go head-to-head to save their patients, their jobs and their beer money, all in...",NA,tt0775536,3.5,,Cinemascore,NA
The Good Night,The Good Night,2007,"The Good Night is a movie starring Martin Freeman, Gwyneth Paltrow, and Penélope Cruz. A former pop star who now writes commercial jingles for a living experiences a mid-life crisis.",https://www.imdb.com/video/imdb/vi2106392857,tt0484111,5.8,,Cinemascore,NA
The Heartbreak Kid (2007),The Heartbreak Kid,2007,"The Heartbreak Kid is a movie starring Ben Stiller, Michelle Monaghan, and Malin Akerman. A newly wed man who believes he's just gotten hitched to the perfect woman encounters another lady on his honeymoon.",NA,tt0408839,5.8,,Cinemascore,NA
