movie name,imdb name,year,description,trailer link,movie id,imdb score,rotten score,cinema score,user score
Life As We Know It,Life as We Know It,2010,"Life as We Know It is a movie starring Katherine Heigl, Josh Duhamel, and Josh Lucas. Two single adults become caregivers to an orphaned girl when their mutual best friends die in an accident.",https://www.imdb.com/video/imdb/vi2623997721,tt1055292,6.5,,Cinemascore,NA
My Soul To Take,My Soul to Take,2010,"My Soul to Take is a movie starring Max Thieriot, John Magaro, and Denzel Whitaker. A serial killer returns to his hometown to stalk seven children who share the same birthday as the date he was allegedly put to rest.",https://www.imdb.com/video/imdb/vi2883388953,tt0872230,4.8,10,Cinemascore,NA
Nowhere Boy,Nowhere Boy,2010,"Nowhere Boy is a movie starring Aaron Taylor-Johnson, Kristin Scott Thomas, and Anne-Marie Duff. A chronicle of John Lennon's first years, focused mainly in his adolescence and his relationship with his stern aunt Mimi, who raised...",https://www.imdb.com/video/imdb/vi1754859033,tt1266029,7.1,80,Cinemascore,NA
Secretariat,Secretariat,2010,"Secretariat is a movie starring Diane Lane, John Malkovich, and Margo Martindale. Penny Chenery Tweedy and colleagues guide her long-shot but precocious stallion to set, in 1973, the unbeaten record for winning the Triple Crown.",https://www.imdb.com/video/imdb/vi2618427161,tt1028576,7.2,63,Cinemascore,NA
Stone,NA,2010,NA,NA,NA,NA,49,Cinemascore,NA
Tamara,Tamara Drewe,2010,"Tamara Drewe is a movie starring Gemma Arterton, Luke Evans, and Dominic Cooper. A young newspaper writer returns to her hometown in the English countryside, where her childhood home is being prepped for sale.",https://www.imdb.com/video/imdb/vi2479556121,tt1486190,6.2,32,Cinemascore,NA
Tamara Drewe,Tamara Drewe,2010,"Tamara Drewe is a movie starring Gemma Arterton, Luke Evans, and Dominic Cooper. A young newspaper writer returns to her hometown in the English countryside, where her childhood home is being prepped for sale.",https://www.imdb.com/video/imdb/vi2479556121,tt1486190,6.2,65,Cinemascore,NA
Conviction,Conviction,2010,"Conviction is a movie starring Hilary Swank, Sam Rockwell, and Melissa Leo. A working mother puts herself through law school in an effort to represent her brother, who has been wrongfully convicted of murder and has exhausted his...",https://www.imdb.com/video/imdb/vi4273341977,tt1244754,7.2,,Cinemascore,NA
Hereafter,Hereafter,2010,"Hereafter is a movie starring Matt Damon, Cécile de France, and Bryce Dallas Howard. A drama centered on three people - a blue-collar American, a French journalist and a London school boy - who are touched by death in different ways.",https://www.imdb.com/video/imdb/vi1485637913,tt1212419,6.4,47,Cinemascore,NA
I Want Your Money,I Want Your Money,2010,"I Want Your Money is a movie starring Gary Bauer, Joe Biden, and Ken Blackwell. The film contrasts two views of role that the federal government should play in our daily lives using the words and actions of Ronald Reagan and Barack...",https://www.imdb.com/video/imdb/vi2242644249,tt1560957,4.8,13,Cinemascore,NA
Jackass 3D,Jackass 3D,2010,"Jackass 3D is a movie starring Johnny Knoxville, Steve-O, and Bam Margera. Johnny Knoxville and company return for the third installment of their TV show spin-off, where dangerous stunts and explicit public displays rule.",https://www.imdb.com/video/imdb/vi3940877849,tt1116184,7.0,65,Cinemascore,NA
Red,RED,2010,"RED is a movie starring Bruce Willis, Helen Mirren, and Morgan Freeman. When his peaceful life is threatened by a high-tech assassin, former black-ops Agent Frank Moses (Bruce Willis) reassembles his old team in a last ditch effort...",https://www.imdb.com/video/imdb/vi2156856857,tt1245526,7.0,,Cinemascore,NA
Red,RED,2010,"RED is a movie starring Bruce Willis, Helen Mirren, and Morgan Freeman. When his peaceful life is threatened by a high-tech assassin, former black-ops Agent Frank Moses (Bruce Willis) reassembles his old team in a last ditch effort...",https://www.imdb.com/video/imdb/vi2156856857,tt1245526,7.0,,Cinemascore,NA
Kalamity,Kalamity,2010,"Kalamity is a movie starring Nick Stahl, Jonathan Jackson, and Christopher M. Clark. After a recent breakup, Billy returns to his hometown to find something is not quite right with his best friend.",https://www.imdb.com/video/imdb/vi4109175065,tt1109594,4.6,,Cinemascore,NA
Paranormal Activity 2,Paranormal Activity 2,2010,"Paranormal Activity 2 is a movie starring Katie Featherston, Micah Sloat, and Molly Ephraim. After experiencing what they think are a series of ""break-ins"", a family sets up security cameras around their home, only to realize that...",https://www.imdb.com/video/imdb/vi517736729,tt1536044,5.6,59,Cinemascore,NA
Rising Stars,Rising Stars,2010,"Rising Stars is a movie starring Fisher Stevens, Catherine Mary Stewart, and Barry Corbin. Challenged with creating songs and music videos, three musical acts find more than their futures on the line when the competition gets fierce...",https://www.imdb.com/video/imdb/vi4208593177,tt1470910,4.4,,Cinemascore,NA
Bella,NA,2010,NA,NA,NA,NA,42,Cinemascore,NA
Eichmann,NA,2010,NA,NA,NA,NA,,Cinemascore,NA
Jolene,Jolene,2010,"Jolene is a movie starring Jessica Chastain, Frances Fisher, and Rupert Friend. A teenage orphan spends ten years traveling cross-country experiencing life, love and heartbreak. Based on E.L. Doctorow's story, ""Jolene: A Life.""",https://www.imdb.com/video/imdb/vi2875300121,tt0867334,6.4,48,Cinemascore,NA
Shake Hands With The Devil,NA,2010,NA,NA,NA,NA,60,Cinemascore,NA
The Girl Who Kicked The Hornet's Nest,Luftslottet som sprängdes,2010,"Luftslottet som sprängdes is a movie starring Michael Nyqvist, Noomi Rapace, and Lena Endre. Lisbeth is recovering in a hospital and awaiting trial for three murders when she is released. Mikael must prove her innocence, but Lisbeth...",https://www.imdb.com/video/imdb/vi650316057,tt1343097,7.3,54,Cinemascore,NA
Welcome To Rileys,Welcome to the Rileys,2010,"Welcome to the Rileys is a movie starring James Gandolfini, Kristen Stewart, and Melissa Leo. On a business trip to New Orleans, a damaged man seeks salvation by caring for a wayward young woman.",https://www.imdb.com/video/imdb/vi2107311641,tt1183923,7.0,,Cinemascore,NA
Wild Target,Wild Target,2010,"Wild Target is a movie starring Bill Nighy, Emily Blunt, and Rupert Grint. A hitman tries to retire but a beautiful thief may change his plans.",https://www.imdb.com/video/imdb/vi2059995417,tt1235189,6.8,33,Cinemascore,NA
127 Hours (2010),127 Hours,2010,"127 Hours is a movie starring James Franco, Amber Tamblyn, and Kate Mara. An adventurous mountain climber becomes trapped under a boulder while canyoneering alone near Moab, Utah and resorts to desperate measures in order to survive.",https://www.imdb.com/video/imdb/vi768149785,tt1542344,7.6,,Cinemascore,NA
Client 9,Client 9: The Rise and Fall of Eliot Spitzer,2010,"Client 9: The Rise and Fall of Eliot Spitzer is a movie starring Eliot Spitzer, Alex Gibney, and Hulbert Waldroup. An in-depth look at the rise and fall of New York Governor Eliot Spitzer, including interviews with the scandalized,...",https://www.imdb.com/video/imdb/vi3721791769,tt1638362,7.4,90,Cinemascore,NA
Due Date,Due Date,2010,"Due Date is a movie starring Robert Downey Jr., Zach Galifianakis, and Michelle Monaghan. High-strung father-to-be Peter Highman is forced to hitch a ride with aspiring actor Ethan Tremblay on a road trip in order to make it to his...",https://www.imdb.com/video/imdb/vi879925529,tt1231583,6.5,40,Cinemascore,NA
Fair Game,Fair Game,2010,"Fair Game is a movie starring Naomi Watts, Sean Penn, and Sonya Davison. CIA operative Valerie Plame discovers her identity is allegedly leaked by the government as payback for an op-ed article her husband wrote criticizing the Bush...",https://www.imdb.com/video/imdb/vi3772581401,tt0977855,6.8,,Cinemascore,NA
For Colored Girls,For Colored Girls,2010,"For Colored Girls is a movie starring Janet Jackson, Anika Noni Rose, and Whoopi Goldberg. Each of the women portray one of the characters represented in the collection of twenty poems, revealing different issues that impact women...",https://www.imdb.com/video/imdb/vi2727282969,tt1405500,6.1,,Cinemascore,NA
Megamind,Megamind,2010,"Megamind is a movie starring Will Ferrell, Jonah Hill, and Brad Pitt. The supervillain Megamind finally defeats his nemesis, the superhero Metro Man. But without a hero, he loses all purpose and must find new meaning to his life.",https://www.imdb.com/video/imdb/vi1938229529,tt1001526,7.2,72,Cinemascore,NA
Morning Glory,Morning Glory,2010,"Morning Glory is a movie starring Rachel McAdams, Harrison Ford, and Diane Keaton. An upstart television producer accepts the challenge of reviving a struggling morning show program with warring co-hosts.",https://www.imdb.com/video/imdb/vi1517263129,tt1126618,6.5,70,Cinemascore,NA
Skyline,Skyline,2010,"Skyline is a movie starring Eric Balfour, Donald Faison, and Scottie Thompson. Strange lights descend on the city of Los Angeles, drawing people outside like moths to a flame where an extraterrestrial force threatens to swallow the...",https://www.imdb.com/video/imdb/vi668403225,tt1564585,4.4,,Cinemascore,NA
Tiny Furniture,Tiny Furniture,2010,"Tiny Furniture is a movie starring Lena Dunham, Laurie Simmons, and Grace Dunham. About a recent college grad who returns home while she tries to figure out what to do with her life.",https://www.imdb.com/video/imdb/vi4146895129,tt1570989,6.2,80,Cinemascore,NA
Unstoppable,Unstoppable,2010,"Unstoppable is a movie starring Denzel Washington, Chris Pine, and Rosario Dawson. With an unmanned, half-mile-long freight train barreling toward a city, a veteran engineer and a young conductor race against the clock to prevent a...",https://www.imdb.com/video/imdb/vi3068790297,tt0477080,6.7,80,Cinemascore,NA
Harry Potter And The Deathly Hallows: Part 1,Harry Potter and the Deathly Hallows: Part 1,2010,"Harry Potter and the Deathly Hallows: Part 1 is a movie starring Daniel Radcliffe, Emma Watson, and Rupert Grint. As Harry, Ron and Hermione race against time and evil to destroy the Horcruxes, they uncover the existence of the...",https://www.imdb.com/video/imdb/vi1023514905,tt0926084,7.7,77,Cinemascore,NA
Made In Dagenham,Made in Dagenham,2010,"Made in Dagenham is a movie starring Sally Hawkins, Bob Hoskins, and Andrea Riseborough. A dramatization of the 1968 strike at the Ford Dagenham car plant, where female workers walked out in protest against sexual discrimination.",https://www.imdb.com/video/imdb/vi3995048217,tt1371155,7.2,80,Cinemascore,NA
Next Three Days,The Next Three Days,2010,"The Next Three Days is a movie starring Russell Crowe, Elizabeth Banks, and Liam Neeson. A married couple's life is turned upside down when the wife is accused of a murder.",https://www.imdb.com/video/imdb/vi2143750425,tt1458175,7.4,51,Cinemascore,NA
Queen Of The Lot,Queen of the Lot,2010,"Queen of the Lot is a movie starring Tanna Frederick, Noah Wyle, and Christopher Rydell. An electronic ankle bracelet and being under house arrest aren't about to stop up-and-coming actress Maggie Chase (Tanna Frederick) from the...",https://www.imdb.com/video/imdb/vi3389036825,tt1342122,5.6,31,Cinemascore,NA
Burlesque,Burlesque,2010,"Burlesque is a movie starring Cher, Christina Aguilera, and Alan Cumming. A small-town girl ventures to Los Angeles and finds her place in a neo-burlesque club run by a former dancer.",https://www.imdb.com/video/imdb/vi1405094169,tt1126591,6.4,36,Cinemascore,NA
Faster,Faster,2010,"Faster is a movie starring Dwayne Johnson, Billy Bob Thornton, and Maggie Grace. An ex-con gets on a series of apparently unrelated killings. He gets tracked by a veteran cop with secrets of his own and an egocentric hit man.",https://www.imdb.com/video/imdb/vi4163606809,tt1433108,6.4,53,Cinemascore,NA
Legend Of Pale Male,The Legend of Pale Male,2010,NA,https://www.imdb.com/video/imdb/vi3573586201,tt1699158,9.1,,Cinemascore,NA
Love And Other Drugs,Love & Other Drugs,2010,"Love & Other Drugs is a movie starring Jake Gyllenhaal, Anne Hathaway, and Judy Greer. A young woman suffering from Parkinson's befriends a drug rep working for Pfizer in 1990s Pittsburgh.",https://www.imdb.com/video/imdb/vi2329347609,tt0758752,6.7,48,Cinemascore,NA
Nutcracker (2010),The Nutcracker in 3D,2010,"The Nutcracker in 3D is a movie starring Richard Philipps, Fernanda Dorogi, and Kriszta Dorogi. In 1920s Vienna, a young girl receives a magical doll on Christmas Eve.",https://www.imdb.com/video/imdb/vi3906472217,tt1041804,4.2,,Cinemascore,NA
Tangled,Tangled,2010,"Tangled is a movie starring Mandy Moore, Zachary Levi, and Donna Murphy. The magically long-haired Rapunzel has spent her entire life in a tower, but now that a runaway thief has stumbled upon her, she is about to discover the world...",https://www.imdb.com/video/imdb/vi385091865,tt0398286,7.7,89,Cinemascore,NA
The King's Speech,The King's Speech,2010,"The King's Speech is a movie starring Colin Firth, Geoffrey Rush, and Helena Bonham Carter. The story of King George VI, his impromptu ascension to the throne of the British Empire in 1936, and the speech therapist who helped the...",https://www.imdb.com/video/imdb/vi806197529,tt1504320,8.0,95,Cinemascore,NA
A Christmas Tale,Un conte de Noël,2010,"Un conte de Noël is a movie starring Catherine Deneuve, Jean-Paul Roussillon, and Mathieu Amalric. The troubled Vuillard family is no stranger to illness, grief, and banishment, but when their matriarch requires a bone-marrow...",https://www.imdb.com/video/imdb/vi541196313,tt0993789,7.1,,Cinemascore,NA
All Good Things,All Good Things,2010,"All Good Things is a movie starring Ryan Gosling, Kirsten Dunst, and Frank Langella. Mr. David Marks was suspected but never tried for killing his wife Katie who disappeared in 1982, but the truth is eventually revealed.",https://www.imdb.com/video/imdb/vi4062157081,tt1175709,6.3,,Cinemascore,NA
Black Swan,Black Swan,2010,"Black Swan is a movie starring Natalie Portman, Mila Kunis, and Vincent Cassel. A committed dancer struggles to maintain her sanity after winning the lead role in a production of Tchaikovsky's ""Swan Lake"".",https://www.imdb.com/video/imdb/vi3985807385,tt0947798,8.0,80,Cinemascore,NA
I Love You Phillip Morris,I Love You Phillip Morris,2010,"I Love You Phillip Morris is a movie starring Jim Carrey, Ewan McGregor, and Leslie Mann. A cop turns con man once he comes out of the closet. Once imprisoned, he meets the second love of his life, whom he'll stop at nothing to be...",https://www.imdb.com/video/imdb/vi4149844249,tt1045772,6.6,71,Cinemascore,NA
Rare Exports,Rare Exports,2010,"Rare Exports is a movie starring Jorma Tommila, Onni Tommila, and Peeter Jakobi. In the depths of the Korvatunturi mountains, 486 meters deep, lies the closest ever guarded secret of Christmas. The time has come to dig it up. This...",https://www.imdb.com/video/imdb/vi192256281,tt1401143,6.7,89,Cinemascore,NA
Eden,Eden,2010,"Eden is a movie starring Jamie Chung, Beau Bridges, and Matt O'Leary. A young Korean-American girl, abducted and forced into prostitution by domestic human traffickers, cooperates with her captors in a desperate ploy to survive.",https://www.imdb.com/video/imdb/vi2075960857,tt1734433,6.6,,Cinemascore,NA
The Chronicles Of Narnia 3: The Voyage Of The Dawn Treader,The Chronicles of Narnia: The Voyage of the Dawn Treader,2010,"The Chronicles of Narnia: The Voyage of the Dawn Treader is a movie starring Ben Barnes, Skandar Keynes, and Georgie Henley. Lucy and Edmund Pevensie return to Narnia with their cousin Eustace where they meet up with Prince Caspian...",https://www.imdb.com/video/imdb/vi2423167257,tt0980970,6.3,,Cinemascore,NA
The Chronicles Of Narnia 3: The Voyage Of The Dawn Treader,The Chronicles of Narnia: The Voyage of the Dawn Treader,2010,"The Chronicles of Narnia: The Voyage of the Dawn Treader is a movie starring Ben Barnes, Skandar Keynes, and Georgie Henley. Lucy and Edmund Pevensie return to Narnia with their cousin Eustace where they meet up with Prince Caspian...",https://www.imdb.com/video/imdb/vi2423167257,tt0980970,6.3,,Cinemascore,NA
The Fighter,The Fighter,2010,"The Fighter is a movie starring Mark Wahlberg, Christian Bale, and Amy Adams. Based on the story of Micky Ward, a fledgling boxer who tries to escape the shadow of his more famous but troubled older boxing brother and get his own...",https://www.imdb.com/video/imdb/vi2330986777,tt0964517,7.8,91,Cinemascore,NA
The Tempest,The Tempest,2010,"The Tempest is a movie starring Helen Mirren, Felicity Jones, and Djimon Hounsou. Shakespeare's epic play is translated from page to screen, with the gender of the main character, Prospero, changed from male to female.",https://www.imdb.com/video/imdb/vi1808206105,tt1274300,5.3,,Cinemascore,NA
The Tourist,The Tourist,2010,"The Tourist is a movie starring Johnny Depp, Angelina Jolie, and Paul Bettany. Revolves around Frank, an American tourist visiting Italy to mend a broken heart. Elise is an extraordinary woman who deliberately crosses his path.",https://www.imdb.com/video/imdb/vi304847129,tt1243957,6.0,,Cinemascore,NA
How Do You Know?,How Do You Know,2010,"How Do You Know is a movie starring Reese Witherspoon, Paul Rudd, and Owen Wilson. After being cut from the U.S.A. softball team and feeling a bit past her prime, Lisa finds herself evaluating her life and in the middle of a love...",https://www.imdb.com/video/imdb/vi3436250649,tt1341188,5.4,32,Cinemascore,NA
Rabbit Hole,Rabbit Hole,2010,"Rabbit Hole is a movie starring Nicole Kidman, Aaron Eckhart, and Dianne Wiest. Life for a happy couple is turned upside down after their young son dies in an accident.",https://www.imdb.com/video/imdb/vi3003816217,tt0935075,7.0,86,Cinemascore,NA
Yogi Bear,Yogi Bear,2010,"Yogi Bear is a movie starring Dan Aykroyd, Justin Timberlake, and Anna Faris. A documentary filmmaker travels to Jellystone Park to shoot a project and soon crosses paths with Yogi Bear, his sidekick Boo-Boo and Ranger Smith.",https://www.imdb.com/video/imdb/vi2698381593,tt1302067,4.6,13,Cinemascore,NA
Country Strong,Country Strong,2010,"Country Strong is a movie starring Garrett Hedlund, Gwyneth Paltrow, and Leighton Meester. A rising country-music songwriter works with a fallen star to work their way to fame, causing romantic complications along the way.",https://www.imdb.com/video/imdb/vi3633252633,tt1555064,6.3,22,Cinemascore,NA
Little Fockers,Little Fockers,2010,"Little Fockers is a movie starring Ben Stiller, Teri Polo, and Robert De Niro. Family-patriarch Jack Byrnes wants to appoint a successor. Does his son-in-law, the male nurse Greg Focker, have what it takes?",https://www.imdb.com/video/imdb/vi1213372697,tt0970866,5.5,9,Cinemascore,NA
True Grit,True Grit,2010,"True Grit is a movie starring Jeff Bridges, Matt Damon, and Hailee Steinfeld. A stubborn teenager enlists the help of a tough U.S. Marshal to track down her father's murderer.",https://www.imdb.com/video/imdb/vi1984862489,tt1403865,7.6,88,Cinemascore,NA
Barney's Version,Barney's Version,2010,"Barney's Version is a movie starring Paul Giamatti, Rosamund Pike, and Jake Hoffman. The picaresque and touching story of the politically incorrect, fully lived life of the impulsive, irascible and fearlessly blunt Barney Panofsky.",https://www.imdb.com/video/imdb/vi2035980569,tt1423894,7.3,79,Cinemascore,NA
Gulliver's Travels (2010),Gulliver's Travels,2010,"Gulliver's Travels is a movie starring Jack Black, Emily Blunt, and Jason Segel. Travel writer Lemuel Gulliver takes an assignment in Bermuda, but ends up on the island of Lilliput, where he towers over its tiny citizens.",https://www.imdb.com/video/imdb/vi2625476889,tt1320261,4.9,,Cinemascore,NA
The Illusionist,L'illusionniste,2010,"L'illusionniste is a movie starring Jean-Claude Donda, Eilidh Rankin, and Duncan MacNeil. A French illusionist finds himself out of work and travels to Scotland, where he meets a young woman. Their ensuing adventure changes both...",https://www.imdb.com/video/imdb/vi996383001,tt0775489,7.5,91,Cinemascore,NA
The Illusionist (2010),L'illusionniste,2010,"L'illusionniste is a movie starring Jean-Claude Donda, Eilidh Rankin, and Duncan MacNeil. A French illusionist finds himself out of work and travels to Scotland, where he meets a young woman. Their ensuing adventure changes both...",https://www.imdb.com/video/imdb/vi996383001,tt0775489,7.5,,Cinemascore,NA
Another Year,Another Year,2010,"Another Year is a movie starring Jim Broadbent, Ruth Sheen, and Lesley Manville. A look at four seasons in the lives of a happily married couple and their relationships with their family and friends.",https://www.imdb.com/video/imdb/vi4561177,tt1431181,7.3,92,Cinemascore,NA
Blue Valentine,Blue Valentine,2010,"Blue Valentine is a movie starring Ryan Gosling, Michelle Williams, and John Doman. The relationship of a contemporary married couple, charting their evolution over a span of years by cross-cutting between time periods.",https://www.imdb.com/video/imdb/vi2838075673,tt1120985,7.4,87,Cinemascore,NA
