movie name,imdb name,year,description,trailer link,movie id,imdb score,rotten score,cinema score,user score
Gaga Five Foot Two,Gaga: Five Foot Two,2017,"Gaga: Five Foot Two is a movie starring Sandra Amador, Michael Bearden, and Tony Bennett. This documentary goes behind the scenes with pop provocateur Lady Gaga as she releases a bold new album and prepares for her Super Bowl...",https://www.imdb.com/video/imdb/vi4269390105,tt7291268,7.1,74,Cinemascore,NA
Kingsman The Golden Circle,Kingsman: The Golden Circle,2017,"Kingsman: The Golden Circle is a movie starring Taron Egerton, Colin Firth, and Mark Strong. When their headquarters are destroyed and the world is held hostage, the Kingsman's journey leads them to the discovery of an allied spy...",https://www.imdb.com/video/imdb/vi734968089,tt4649466,6.8,52,Cinemascore,NA
Last Rampage,Last Rampage: The Escape of Gary Tison,2017,"Last Rampage: The Escape of Gary Tison is a movie starring Robert Patrick, Heather Graham, and Bruce Davison. The true story of the infamous prison break of Gary Tison and Randy Greenwalt from the Arizona State prison in Florence,...",https://www.imdb.com/video/imdb/vi3424893209,tt5833186,5.7,60,Cinemascore,NA
Loving Vincent,Loving Vincent,2017,"Loving Vincent is a movie starring Douglas Booth, Jerome Flynn, and Robert Gulaczyk. In a story depicted in oil painted animation, a young man comes to the last hometown of painter Vincent van Gogh to deliver the troubled artist's...",https://www.imdb.com/video/imdb/vi1862449433,tt3262342,7.8,85,Cinemascore,NA
Newton,Newton,2017,"Newton is a movie starring Rajkummar Rao, Pankaj Tripathi, and Anjali Patil. A government clerk on election duty in the conflict ridden jungle of Central India tries his best to conduct free and fair voting despite the apathy of...",https://www.imdb.com/video/imdb/vi4044011801,tt6484982,7.7,94,Cinemascore,NA
Shot,Long Shot,2017,"Long Shot is a movie starring Charlize Theron, Seth Rogen, and June Diane Raphael. Journalist Fred Flarsky reunites with his childhood crush, Charlotte Field, now one of the most influential women in the world. As she prepares to...",https://www.imdb.com/video/imdb/vi1734982169,tt2139881,6.9,53,Cinemascore,NA
Stronger,Stronger,2017,"Stronger is a movie starring Jake Gyllenhaal, Tatiana Maslany, and Miranda Richardson. Stronger is the inspiring real life story of Jeff Bauman, an ordinary man who captured the hearts of his city and the world to become a symbol of...",https://www.imdb.com/video/imdb/vi468629785,tt3881784,6.9,90,Cinemascore,NA
The King's Choice,Kongens nei,2017,"Kongens nei is a movie starring Jesper Christensen, Anders Baasmo Christiansen, and Karl Markovics. April 1940. Norway has been invaded by Germany and the royal family and government have fled into the interior. The German envoy to...",https://www.imdb.com/video/imdb/vi1167899417,tt4353996,7.1,84,Cinemascore,NA
The Lego Ninjago Movie,The Lego Ninjago Movie,2017,"The Lego Ninjago Movie is a movie starring Jackie Chan, Dave Franco, and Fred Armisen. Shunned by everyone for being the son of an evil warlord, a teenager seeks to defeat him with the help of his fellow ninjas.",https://www.imdb.com/video/imdb/vi3483744281,tt3014284,6.0,55,Cinemascore,NA
The Tiger Hunter,The Tiger Hunter,2017,"The Tiger Hunter is a movie starring Danny Pudi, Rizwan Manji, and Jon Heder. A young Indian man relocates to 1970s Chicago to become an engineer, but when his job falls through, resorts to an elaborate charade with misfit friends...",https://www.imdb.com/video/imdb/vi1664596249,tt3853830,5.7,78,Cinemascore,NA
Unrest,Unrest,2017,"Unrest is a movie starring Jennifer Brea, Omar Wasow, and Jessica l e Taylor. When Harvard Ph.D. student Jennifer Brea is struck down by a fever that leaves her bedridden, she sets out on a virtual journey to document her story as...",NA,tt3268850,7.7,100,Cinemascore,NA
Victoria and Abdul,Victoria & Abdul,2017,"Victoria & Abdul is a movie starring Judi Dench, Ali Fazal, and Tim Pigott-Smith. Queen Victoria strikes up an unlikely friendship with a young Indian clerk named Abdul Karim.",https://www.imdb.com/video/imdb/vi3102783769,tt5816682,6.8,66,Cinemascore,NA
Welcome To Willits,Welcome to Willits,2017,"Welcome to Willits is a movie starring Bill Sage, Chris Zylka, and Anastasia Baranova. Deep in the Northern California woods, in the heart of the notorious Emerald Triangle, lies a remote cabin. The residents struggle to fight off...",https://www.imdb.com/video/imdb/vi914340121,tt3074952,4.1,,Cinemascore,NA
Woodshock,Woodshock,2017,"Woodshock is a movie starring Kirsten Dunst, Joe Cole, and Pilou Asbæk. A haunted young woman spirals in the wake of profound loss, torn between her fractured emotional state and the reality-altering effects of a potent cannabinoid...",https://www.imdb.com/video/imdb/vi865646873,tt4677924,4.2,23,Cinemascore,NA
Clive Davis The Soundtrack of Our Lives,Clive Davis: The Soundtrack of Our Lives,2017,"Clive Davis: The Soundtrack of Our Lives is a movie starring Clive Davis, Simon Cowell, and Jimmy Iovine. A look at the life and work of music producer, Clive Davis.",NA,tt6494358,7.4,88,Cinemascore,NA
I Am Another You,I Am Another You,2017,"I Am Another You is a movie starring Dylan and Nanfu Wang. Eating garbage, dodging police, and hitching rides with strangers, award-winning Chinese filmmaker Nanfu Wang shares the streets with a young drifter named Dylan who left a...",NA,tt6098544,7.3,100,Cinemascore,NA
A Question of Faith,A Question of Faith,2017,"A Question of Faith is a movie starring Richard T. Jones, Kim Fields, and C. Thomas Howell. When tragedy strikes three families, their destiny forces them on a converging path to discover God's love, grace and mercy as the...",https://www.imdb.com/video/imdb/vi3866343705,tt6054650,5.6,40,Cinemascore,NA
Abundant Acreage Available,Abundant Acreage Available,2017,"Abundant Acreage Available is a movie starring Steve Coulter, Max Gail, and Francis Guinan. After their father dies, a middle-aged brother and sister wrestle with legacy and ownership when three brothers, whose family farmed the...",https://www.imdb.com/video/imdb/vi2149103897,tt5462906,5.9,89,Cinemascore,NA
AlphaGo,AlphaGo,2017,"AlphaGo is a movie starring Ioannis Antonoglou, Lucas Baker, and Nick Bostrom. With more board configurations than there are atoms in the observable universe, the ancient Chinese game of 'Go' has long been considered a grand...",https://www.imdb.com/video/imdb/vi3563567385,tt6700846,7.9,100,Cinemascore,NA
American Made,American Made,2017,"American Made is a movie starring Tom Cruise, Domhnall Gleeson, and Sarah Wright. The story of Barry Seal, an American pilot who became a drug-runner for the CIA in the 1980s in a clandestine operation that would be exposed as the...",https://www.imdb.com/video/imdb/vi2568337689,tt3532216,7.1,86,Cinemascore,NA
Blood Stripe,Blood Stripe,2017,"Blood Stripe is a movie starring Chris Sullivan, Rene Auberjonois, and Tom Lipinski. The trials and tribulations of a female combat veteran and her battle with vigorous PTSD.",https://www.imdb.com/video/imdb/vi1047181593,tt3838802,6.1,86,Cinemascore,NA
Different Flowers,Different Flowers,2017,"Different Flowers is a movie starring Emma Bell, Hope Lauren, and Shelley Long. On the day of her big Midwestern wedding, Millie, a persnickety bride, jilts her fiance at the altar with the help of her spunky younger sister, Emma,...",https://www.imdb.com/video/imdb/vi879343897,tt6096194,5.2,,Cinemascore,NA
Don't Sleep,Don't Sleep,2017,"Don't Sleep is a movie starring Dominic Sherwood, Charlbi Dean Kriek, and Jill Hennessy. After moving into a cottage together, two young lovers confront the horrors of a forgotten childhood.",https://www.imdb.com/video/imdb/vi738834713,tt4329806,3.3,9,Cinemascore,NA
Flatliners,Flatliners,2017,"Flatliners is a movie starring Ellen Page, Diego Luna, and Nina Dobrev. Five medical students, obsessed by what lies beyond the confines of life, embark on a daring experiment: by stopping their hearts for short periods, each...",https://www.imdb.com/video/imdb/vi537508121,tt2039338,5.2,4,Cinemascore,NA
Literally Right Before Aaron,"Literally, Right Before Aaron",2017,"Literally, Right Before Aaron is a movie starring Cobie Smulders, Lea Thompson, and Justin Long. Still reeling from his breakup with college sweetheart Allison, Adam's world is thrown into further chaos when he's surprisingly...",https://www.imdb.com/video/imdb/vi655407385,tt5758802,4.5,25,Cinemascore,NA
Lucky,Lucky,2017,"Lucky is a movie starring Harry Dean Stanton, David Lynch, and Ron Livingston. The spiritual journey of a ninety-year-old atheist.",https://www.imdb.com/video/imdb/vi2145368345,tt5859238,7.3,,Cinemascore,NA
Mark Felt The Man Who Brought Down the White House,Mark Felt: The Man Who Brought Down the White House,2017,"Mark Felt: The Man Who Brought Down the White House is a movie starring Liam Neeson, Diane Lane, and Marton Csokas. The story of Mark Felt, who under the name ""Deep Throat"" helped journalists Bob Woodward and Carl Bernstein uncover...",https://www.imdb.com/video/imdb/vi52345113,tt5175450,6.4,35,Cinemascore,NA
Realive,Realive,2017,"Realive is a movie starring Tom Hughes, Charlotte Le Bon, and Oona Chaplin. Marc will die of cancer and chooses cryogenic freeze and hopes to be thawed, when there's a solution to his condition. He's the first human brought back 68...",https://www.imdb.com/video/imdb/vi1411299609,tt4074928,5.9,79,Cinemascore,NA
SPF 18,SPF-18,2017,"SPF-18 is a movie starring Carson Meyer, Noah Centineo, and Bianca A. Santos. 18-year-old Penny Cooper spent years pining for Johnny Sanders Jr., but when a mysterious musician shows up on the beach, Penny is torn.",https://www.imdb.com/video/imdb/vi488487193,tt7296862,3.3,,Cinemascore,NA
Super Dark Times,Super Dark Times,2017,"Super Dark Times is a movie starring Owen Campbell, Charlie Tahan, and Elizabeth Cappuccino. Teenagers Zach and Josh have been best friends their whole lives, but when a gruesome accident leads to a cover-up, the secret drives a...",https://www.imdb.com/video/imdb/vi2973612313,tt5112578,6.6,89,Cinemascore,NA
Take Every Wave The Life of Laird Hamilton,Take Every Wave: The Life of Laird Hamilton,2017,"Take Every Wave: The Life of Laird Hamilton is a movie starring Nick Carroll, Darrick Doerner, and Laird Hamilton. This is the remarkable story of an American icon who changed the sport of big wave surfing forever. Transcending the...",https://www.imdb.com/video/imdb/vi1829353753,tt6333092,7.3,76,Cinemascore,NA
The Pathological Optimist,The Pathological Optimist,2017,NA,https://www.imdb.com/video/imdb/vi1627568409,tt6391732,5.8,60,Cinemascore,NA
The Sound,The Sound,2017,"The Sound is a movie starring Rose McGowan, Christopher Lloyd, and Michael Eklund. A supernatural skeptic sets off to debunk paranormal sightings using low frequency sound waves in an abandoned subway station and is met with...",https://www.imdb.com/video/imdb/vi3954161689,tt4669278,3.6,25,Cinemascore,NA
Til Death Do Us Part,Til Death Do Us Part,2017,"Til Death Do Us Part is a movie starring Taye Diggs, Annie Ilonzeh, and Stephen Bishop. Michael and Madison Roland had planned to spend the rest of their lives together, until one day Michael's controlling ways turned their perfect...",https://www.imdb.com/video/imdb/vi2529999129,tt6848602,4.5,,Cinemascore,NA
Top Cat Begins,Don Gato: El Inicio de la Pandilla,2017,"Don Gato: El Inicio de la Pandilla is a movie starring Jason Harris, Chris Edgerly, and Bill Lobley. Top Cat has arrived to charm his way into your hearts. Ever wonder how this scheming feline got his start? Well Top Cat Begins...",https://www.imdb.com/video/imdb/vi3996891417,tt4057916,4.1,17,Cinemascore,NA
2307 Winter's Dream,2307: Winter's Dream,2017,"2307: Winter's Dream is a movie starring Paul Sidhu, Arielle Holmes, and Branden Coles. In 2307, a soldier is sent on a mission to hunt down the leader of the humanoid rebellion.",https://www.imdb.com/video/imdb/vi192920089,tt4261326,3.8,,Cinemascore,NA
Assholes,Assholes,2017,"Assholes is a movie starring Betsey Brown, Patrick Labella, and Jack Dunphy. Adah and Aaron are literally Assholes.",NA,tt6098486,4.4,20,Cinemascore,NA
Better Watch Out,Better Watch Out,2017,"Better Watch Out is a movie starring Olivia DeJonge, Levi Miller, and Ed Oxenbould. On a quiet suburban street, a babysitter must defend a twelve-year-old boy from intruders, only to discover it's far from a normal home invasion.",https://www.imdb.com/video/imdb/vi561297689,tt4443658,6.5,89,Cinemascore,NA
Blade Runner 2049,Blade Runner 2049,2017,"Blade Runner 2049 is a movie starring Harrison Ford, Ryan Gosling, and Ana de Armas. A young blade runner's discovery of a long-buried secret leads him to track down former blade runner Rick Deckard, who's been missing for thirty...",https://www.imdb.com/video/imdb/vi3362371865,tt1856101,8.0,87,Cinemascore,NA
Chavela,Chavela,2017,"Chavela is a movie starring Eugenia León, Jesusa Rodríguez, and Tania Libertad. The life of pioneering singer Chavela Vargas, from her birth in Costa Rica in 1919 to her death in Mexico in 2012.",https://www.imdb.com/video/imdb/vi33863193,tt6217664,7.8,95,Cinemascore,NA
Cold Moon,Cold Moon,2017,"Cold Moon is a movie starring Josh Stewart, Candy Clark, and Robbie Kay. From Michael McDowell, the writer of Beetlejuice (1988) and The Nightmare Before Christmas (1993), comes a chilling tale of supernatural vengeance.",https://www.imdb.com/video/imdb/vi721795097,tt4441098,4.5,71,Cinemascore,NA
Dina,NA,2017,NA,NA,NA,NA,98,Cinemascore,NA
Earth One Amazing Day,Earth: One Amazing Day,2017,"Earth: One Amazing Day is a movie starring Robert Redford and Jackie Chan. From BBC Earth Films, the studio that brought you Earth, comes the sequel - Earth: One Amazing Day, an astonishing journey revealing the awesome power of the...",https://www.imdb.com/video/imdb/vi1701886233,tt6238896,7.7,100,Cinemascore,NA
Faces Places,Visages villages,2017,"Visages villages is a movie starring Agnès Varda, JR, and Jeannine Carpentier. Director Agnes Varda and photographer/muralist J.R. journey through rural France and form an unlikely friendship.",https://www.imdb.com/video/imdb/vi3444423193,tt5598102,7.9,99,Cinemascore,NA
Generational Sins,Generational Sins,2017,"Generational Sins is a movie starring Daniel MacPherson, Dax Spanogle, and Barrett Donner. A dying mother, Sarah, tells her last wish to her eldest son, Drew, that he take his younger brother, Will, to the place they were born....",https://www.imdb.com/video/imdb/vi305379609,tt5668054,7.7,33,Cinemascore,NA
My Little Pony The Movie,My Little Pony: The Movie,2017,"My Little Pony: The Movie is a movie starring Emily Blunt, Kristin Chenoweth, and Liev Schreiber. After a dark force conquers Canterlot, the Mane 6 embark on an unforgettable journey beyond Equestria where they meet new friends and...",https://www.imdb.com/video/imdb/vi326154521,tt4131800,6.1,48,Cinemascore,NA
Overdrive,Overdrive,2017,"Overdrive is a movie starring Scott Eastwood, Freddie Thorp, and Ana de Armas. Two car thief brothers, who journey to the south of France for new opportunities, wind up in the cross hairs of the local crime boss.",https://www.imdb.com/video/imdb/vi1661122841,tt1935194,5.4,23,Cinemascore,NA
Paradise,Paradise Hills,2017,"Paradise Hills is a movie starring Eiza González, Emma Roberts, and Danielle Macdonald. A mysterious boarding school perfectly reforms wayward girls to fit their surroundings' exact desires.",https://www.imdb.com/video/imdb/vi3557014553,tt6127004,6.6,,Cinemascore,NA
So B It,Sobibor,2017,"Sobibor is a movie starring Konstantin Khabenskiy, Christopher Lambert, and Mariya Kozhevnikova. ""Sobibor"" is based on the history of the Sobibór extermination camp uprising during WWII and Soviet officer Alexander Pechersky. When...",NA,tt6324614,6.3,40,Cinemascore,NA
The Crucifixion,The Crucifixion,2017,"The Crucifixion is a movie starring Sophie Cookson, Corneliu Ulici, and Ada Lupu. When Nicole comes in contact with Father Anton (Corneliu Ulici) more and more inexplicable events occur. The pair begin to believe that the priest...",https://www.imdb.com/video/imdb/vi3317742105,tt4181782,5.1,6,Cinemascore,NA
The Death and Life of Marsha P. Johnson,The Death and Life of Marsha P. Johnson,2017,"The Death and Life of Marsha P. Johnson is a movie starring Kurt Wolfe, Sue Yacka, and Catherine Shugrue Dos Santos. Victoria Cruz investigates the mysterious 1992 death of black gay rights activist and Stonewall veteran, Marsha P....",https://www.imdb.com/video/imdb/vi2920200473,tt5233558,7.2,,Cinemascore,NA
The Florida Project,The Florida Project,2017,"The Florida Project is a movie starring Brooklynn Prince, Bria Vinaite, and Willem Dafoe. Set over one summer, the film follows precocious six-year-old Moonee as she courts mischief and adventure with her ragtag playmates and bonds...",https://www.imdb.com/video/imdb/vi1518975513,tt5649144,7.6,96,Cinemascore,NA
The Legend of 420,The Legend of 420,2017,"The Legend of 420 is a movie starring Shaun Attwood, W. Earl Brown, and Tommy Chong. A comedy documentary outlining the progression of the ever growing cannabis industry.",https://www.imdb.com/video/imdb/vi794999065,tt7027566,6.7,100,Cinemascore,NA
The Osiris Child,Science Fiction Volume One: The Osiris Child,2017,"Science Fiction Volume One: The Osiris Child is a movie starring Kellan Lutz, Daniel MacPherson, and Isabel Lucas. Set in the future in a time of interplanetary colonization, an unlikely pair race against an impending global crisis...",https://www.imdb.com/video/imdb/vi1512880409,tt4536768,5.6,,Cinemascore,NA
The Stray,The Stray,2017,"The Stray is a movie starring Michael Cassidy, Sarah Lancaster, and Connor Corum. A young father takes his nine-year-old son, the family dog, and two of his son's friends backpacking in the mountains of Colorado only for all five of...",https://www.imdb.com/video/imdb/vi1306376729,tt5342904,5.4,40,Cinemascore,NA
Trafficked,Trafficked,2017,"Trafficked is a movie starring Ashley Judd, Sean Patrick Flanery, and Elisabeth Röhm. In this story inspired by real characters, three girls from America, Nigeria and India are trafficked through an elaborate global network and...",https://www.imdb.com/video/imdb/vi828684569,tt1720621,5.5,17,Cinemascore,NA
Una,Una,2017,"Una is a movie starring Ruby Stokes, Rooney Mara, and David Shields. A woman confronts an older man, her former neighbour, to find out why he abandoned her after they had a sexual relationship.",https://www.imdb.com/video/imdb/vi656324889,tt2315582,6.2,76,Cinemascore,NA
Walking Out,Walking Out,2017,"Walking Out is a movie starring Matt Bomer, Josh Wiggins, and Bill Pullman. An urban teenager journeys to Montana to hunt big game with his estranged father. Father and son struggle to connect, until a brutal encounter in the heart...",https://www.imdb.com/video/imdb/vi1661581593,tt5420886,5.8,90,Cinemascore,NA
6 Below Miracle On The Mountain,6 Below: Miracle on the Mountain,2017,"6 Below: Miracle on the Mountain is a movie starring Josh Hartnett, Mira Sorvino, and Sarah Dumont. An adrenaline seeking snowboarder gets lost in a massive winter storm in the back country of the High Sierras where he is pushed to...",https://www.imdb.com/video/imdb/vi1544599833,tt5503688,5.7,22,Cinemascore,NA
78/52 Hitchcock's Shower Scene,NA,2017,NA,NA,NA,NA,,Cinemascore,NA
B&amp;B,NA,2017,NA,NA,NA,NA,,Cinemascore,NA
Brawl In Cell Block 99,Brawl in Cell Block 99,2017,"Brawl in Cell Block 99 is a movie starring Vince Vaughn, Jennifer Carpenter, and Don Johnson. A former boxer-turned-drug runner lands in a prison battleground after a deal gets deadly.",https://www.imdb.com/video/imdb/vi2602547481,tt5657856,7.1,91,Cinemascore,NA
Breathe,Breathe,2017,"Breathe is a movie starring Andrew Garfield, Claire Foy, and Hugh Bonneville. The inspiring true love story of Robin and Diana Cavendish, an adventurous couple who refuse to give up in the face of a devastating disease. Their...",https://www.imdb.com/video/imdb/vi2539174169,tt5716464,7.1,68,Cinemascore,NA
Gnome Alone,Gnome Alone,2017,"Gnome Alone is a movie starring Becky G, Josh Peck, and Tara Strong. When Chloe discovers that her new home's garden gnomes are not what they seem, she must decide between the pursuit of a desired high school life and taking up the...",https://www.imdb.com/video/imdb/vi2709633561,tt5851786,5.6,,Cinemascore,NA
Goodbye Christopher Robin,Goodbye Christopher Robin,2017,"Goodbye Christopher Robin is a movie starring Domhnall Gleeson, Margot Robbie, and Kelly Macdonald. The relationship between writer AA Milne and his son, Christopher Robin, and how this became the inspiration for Winnie the Pooh.",https://www.imdb.com/video/imdb/vi270579993,tt1653665,7.1,63,-1,NA
Happy Death Day,Happy Death Day,2017,"Happy Death Day is a movie starring Jessica Rothe, Israel Broussard, and Ruby Modine. A college student must relive the day of her murder over and over again, in a loop that will end only when she discovers her killer's identity.",https://www.imdb.com/video/imdb/vi592492825,tt5308322,6.5,71,Cinemascore,NA
Human Flow,Human Flow,2017,"Human Flow is a movie starring Israa Abboud, Hiba Abed, and Rami Abu Sondos. Human Flow is director and artist Ai Weiwei's detailed and heartbreaking exploration into the global refugee crisis.",https://www.imdb.com/video/imdb/vi1729149209,tt6573444,7.0,91,Cinemascore,NA
Marshall,Marshall,2017,"Marshall is a movie starring Chadwick Boseman, Josh Gad, and Kate Hudson. The story of Thurgood Marshall, the crusading lawyer who would become the first African-American Supreme Court Justice, as he battles through one of his...",https://www.imdb.com/video/imdb/vi923056409,tt5301662,7.2,80,Cinemascore,NA
MFA,M.F.A.,2017,"M.F.A. is a movie starring Francesca Eastwood, Clifton Collins Jr., and Leah McKendrick. An art student taps into a rich source of creative inspiration after the accidental slaughter of her rapist. An unlikely vigilante emerges, set...",NA,tt5091530,6.1,77,Cinemascore,NA
Night Of The Living Dead,Night of the Living Dead: Darkest Dawn,2017,"Night of the Living Dead: Darkest Dawn is a movie starring Amanda Niles, Gus Malliarodakis, and Danielle Harris. A group of survivors trapped in a New York apartment fight to stay alive against legions of zombies.",https://www.imdb.com/video/imdb/vi890221337,tt1512222,3.9,97,Cinemascore,NA
Professor Marston and the Wonder Women,Professor Marston and the Wonder Women,2017,"Professor Marston and the Wonder Women is a movie starring Luke Evans, Rebecca Hall, and Bella Heathcote. The story of psychologist William Moulton Marston, and his polyamorous relationship with his wife and their mistress who would...",https://www.imdb.com/video/imdb/vi678344985,tt6133130,7.1,86,Cinemascore,NA
Signature Move,Signature Move,2017,"Signature Move is a movie starring Fawzia Mirza, Shabana Azmi, and Sari Sanchez. Zaynab, a thirty-something Pakistani, Muslim, lesbian in Chicago takes care of her sweet and TV-obsessed mother. As Zaynab falls for Alma, a bold and...",NA,tt5328952,5.7,100,Cinemascore,NA
Swing Away,Swing Away,2017,"Swing Away is a movie starring Shannon Elizabeth, John O'Hurley, and Karl Theobald. Following a meltdown that leads to a suspension, professional golfer Zoe Papadopoulos travels to her grandparents' village in Greece to escape the...",https://www.imdb.com/video/imdb/vi2915088921,tt4653950,5.4,,Cinemascore,NA
The Departure,The Departure,2017,NA,NA,tt6509432,7.1,100,Cinemascore,NA
The Foreigner,The Foreigner,2017,"The Foreigner is a movie starring Katie Leung, Jackie Chan, and Rufus Jones. A humble businessman with a buried past seeks justice when his daughter is killed in an act of terrorism. A cat-and-mouse conflict ensues with a government...",https://www.imdb.com/video/imdb/vi1332787481,tt1615160,7.0,65,Cinemascore,NA
The Meyerowitz Stories,The Meyerowitz Stories (New and Selected),2017,"The Meyerowitz Stories (New and Selected) is a movie starring Adam Sandler, Grace Van Patten, and Dustin Hoffman. An estranged family gathers together in New York City for an event celebrating the artistic work of their father.",https://www.imdb.com/video/imdb/vi477870361,tt5536736,6.9,93,Cinemascore,NA
The Old Dark House,Beneath the Old Dark House,2017,"Beneath the Old Dark House is a movie starring Brinke Stevens, Kaylee Williams, and Christy Johnson. A mysterious being, known only as Coffintooth, welcomes you to his creepy domain, deep in the catacombs of his abode - It is in...",NA,tt3789698,NA,,Cinemascore,NA
The Secret Scripture,The Secret Scripture,2017,"The Secret Scripture is a movie starring Theo James, Rooney Mara, and Aidan Turner. A woman keeps a diary of her extended stay at a mental hospital.",https://www.imdb.com/video/imdb/vi93109017,tt3344694,6.7,36,Cinemascore,NA
Thy Father's Chair,Thy Father's Chair,2017,NA,NA,tt5135256,8.2,80,Cinemascore,NA
Tom of Finland,Tom of Finland,2017,"Tom of Finland is a movie starring Pekka Strang, Seumas F. Sargent, and Chris Myland. Award-winning filmmaker Dome Karukoski brings to screen the life and work of artist Touko Valio Laaksonen (aka Tom of Finland), one of the most...",https://www.imdb.com/video/imdb/vi2020653337,tt5226984,6.8,84,Cinemascore,NA
The Paris Opera,L'Opéra,2017,"L'Opéra is a movie starring Stéphane Lissner and Benjamin Millepied. A behind-the-scenes look at the Paris Opera, under the direction of Stephane Lissner.",NA,tt6599064,7.0,70,Cinemascore,NA
120 Beats Per Minute,120 battements par minute,2017,"120 battements par minute is a movie starring Nahuel Pérez Biscayart, Arnaud Valois, and Adèle Haenel. Members of the advocacy group ACT UP Paris demand action by the government and pharmaceutical companies to combat the AIDS...",https://www.imdb.com/video/imdb/vi1837873689,tt6135348,7.5,98,Cinemascore,NA
