movie name,imdb name,year,description,trailer link,movie id,imdb score,rotten score,cinema score,user score
Weirdsville,Weirdsville,2007,"Weirdsville is a movie starring Scott Speedman, Wes Bentley, and Taryn Manning. A pair of slackers get in way over their heads when they try to dump the body of a dead girlfriend in the basement of a drive-in movie theater where a...",https://www.imdb.com/video/imdb/vi3187409177,tt0758798,6.3,58,Cinemascore,NA
Control,Control,2007,"Control is a movie starring Sam Riley, Samantha Morton, and Craig Parkinson. A profile of Ian Curtis, the enigmatic singer of Joy Division whose personal, professional, and romantic troubles led him to commit suicide at the age of...",https://www.imdb.com/video/imdb/vi2009006361,tt0421082,7.7,,Cinemascore,NA
Bhool Bhulaiyaa,Bhool Bhulaiyaa,2007,"Bhool Bhulaiyaa is a movie starring Akshay Kumar, Vidya Balan, and Shiney Ahuja. An NRI and his wife decide to stay in his ancestral home, paying no heed to the warnings about ghosts. Soon, inexplicable occurrences cause him to call...",https://www.imdb.com/video/imdb/vi2915416345,tt0995031,7.2,20,Cinemascore,NA
Elizabeth 2 - The Golden Age,Elizabeth: The Golden Age,2007,"Elizabeth: The Golden Age is a movie starring Cate Blanchett, Clive Owen, and Geoffrey Rush. A mature Queen Elizabeth endures multiple crises late in her reign including court intrigues, an assassination plot, the Spanish Armada,...",NA,tt0414055,6.8,,Cinemascore,NA
Fat Girls,Fat Girls,2007,"Fat Girls is a movie starring Ash Christian, Jonathan Caouette, and Evan Miller. Fat Girls is an original off-beat comedy feature. It focuses on Rodney Miller, not your typical Texas high school student...he is a theater lover and...",https://www.imdb.com/video/imdb/vi3869442329,tt0439179,4.9,28,Cinemascore,NA
King Corn,King Corn,2007,"King Corn is a movie starring Bob Bledsoe, Earl L. Butz, and Dawn Cheney. King Corn is a feature documentary about two friends, one acre of corn, and the subsidized crop that drives our fast-food nation. In King Corn, Ian Cheney and...",https://www.imdb.com/video/imdb/vi949027097,tt1112115,7.0,,Cinemascore,NA
Lars And The Real Girl,Lars and the Real Girl,2007,"Lars and the Real Girl is a movie starring Ryan Gosling, Emily Mortimer, and Paul Schneider. A delusional young man strikes up an unconventional relationship with a doll he finds on the Internet.",https://www.imdb.com/video/imdb/vi3585147161,tt0805564,7.3,,Cinemascore,NA
Sleuth,Sleuth,2007,"Sleuth is a movie starring Michael Caine, Jude Law, and Harold Pinter. On his sprawling country estate, an aging writer matches wits with the struggling actor who has stolen his wife's heart.",https://www.imdb.com/video/imdb/vi4052222233,tt0857265,6.5,36,Cinemascore,NA
The Final Season,The Final Season,2007,"The Final Season is a movie starring Sean Astin, Powers Boothe, and Rachael Leigh Cook. Kent Stock disrupts his life to become coach of the Norway High School baseball team and try to lead them to victory.",https://www.imdb.com/video/imdb/vi3079405849,tt0449018,6.6,,Cinemascore,NA
We Own The Night,We Own the Night,2007,"We Own the Night is a movie starring Joaquin Phoenix, Mark Wahlberg, and Eva Mendes. A New York City nightclub manager tries to save his brother and father from Russian Mafia hitmen.",https://www.imdb.com/video/imdb/vi3856728345,tt0498399,6.8,57,Cinemascore,NA
O Jerusalem,O Jerusalem,2007,"O Jerusalem is a movie starring JJ Feild, Saïd Taghmaoui, and Maria Papas. A tale of friendship between two men, one Jewish and the other Arab, as the country of Israel is being created.",https://www.imdb.com/video/imdb/vi4003463705,tt0443448,6.1,35,Cinemascore,NA
30 Days Of Night,30 Days of Night,2007,"30 Days of Night is a movie starring Josh Hartnett, Melissa George, and Danny Huston. After an Alaskan town is plunged into darkness for a month, it is attacked by a bloodthirsty gang of vampires.",https://www.imdb.com/video/imdb/vi479462937,tt0389722,6.6,51,Cinemascore,NA
Gone Baby Gone,Gone Baby Gone,2007,"Gone Baby Gone is a movie starring Morgan Freeman, Ed Harris, and Casey Affleck. Two Boston area detectives investigate a little girl's kidnapping, which ultimately turns into a crisis both professionally and personally.",https://www.imdb.com/video/imdb/vi610796825,tt0452623,7.6,94,Cinemascore,NA
Local Color,Local Color,2007,"Local Color is a movie starring Armin Mueller-Stahl, Trevor Morgan, and Ray Liotta. A successful artist looks back with loving memories on the summer of his defining year, 1974. A talented but troubled 18-year-old aspiring artist...",https://www.imdb.com/video/imdb/vi1650393625,tt0472126,6.9,35,Cinemascore,NA
Meeting Resistance,Meeting Resistance,2007,NA,https://www.imdb.com/video/imdb/vi3354045977,tt0823219,7.7,,Cinemascore,NA
Moondance Alexander,Moondance Alexander,2007,"Moondance Alexander is a movie starring Kay Panabaker, Don Johnson, and Lori Loughlin. The curiously named, Moondance Alexander is a spirited teen living with her eccentric mother. She is faced with another uneventful summer until...",NA,tt0828065,6.3,,Cinemascore,NA
Rendition,Rendition,2007,"Rendition is a movie starring Reese Witherspoon, Jake Gyllenhaal, and Peter Sarsgaard. When a terrorist bombing in North Africa kills 19 incl. an American, an Egyptian chemical engineer flying from South Africa to his wife in USA,...",https://www.imdb.com/video/imdb/vi2930835737,tt0804522,6.8,47,Cinemascore,NA
Reservation Road,Reservation Road,2007,"Reservation Road is a movie starring Joaquin Phoenix, Mark Ruffalo, and Jennifer Connelly. The lives of two families change forever after a fatal tragedy takes place on Reservation Road.",https://www.imdb.com/video/imdb/vi3467706649,tt0831884,6.7,38,Cinemascore,NA
Sarah Landon And The Paranormal Hour,Sarah Landon and the Paranormal Hour,2007,"Sarah Landon and the Paranormal Hour is a movie starring Rissa Walters, Brian Comrie, and Dan Comrie. A 17-year-old girl has mysterious encounters with paranormal activity in the small town of Pine Valley.",https://www.imdb.com/video/imdb/vi3682926873,tt0990376,3.7,,Cinemascore,NA
The Comebacks,The Comebacks,2007,"The Comebacks is a movie starring David Koechner, Robert Ri'chard, and Carl Weathers. A comedy that spoofs inspirational sports movies, this movie tells the story of an out-of-luck coach, Lambeau Fields, who takes a rag-tag bunch of...",https://www.imdb.com/video/imdb/vi3534815513,tt0790804,4.3,,Cinemascore,NA
The Ten,The Ten,2007,"The Ten is a movie starring Paul Rudd, Jessica Alba, and Winona Ryder. Ten stories, each inspired by one of the ten commandments.",https://www.imdb.com/video/imdb/vi1325072665,tt0811106,5.0,36,Cinemascore,NA
Things We Lost In The Fire,Things We Lost in the Fire,2007,"Things We Lost in the Fire is a movie starring Halle Berry, Benicio Del Toro, and Alison Lohman. A recent widow invites her husband's troubled best friend to live with her and her two children. As he gradually turns his life around,...",https://www.imdb.com/video/imdb/vi1694302489,tt0469623,7.2,65,Cinemascore,NA
Wristcutters: A Love Story,Wristcutters: A Love Story,2007,"Wristcutters: A Love Story is a movie starring Patrick Fugit, Shea Whigham, and Tom Waits. A film set in a strange afterlife way station that has been reserved for people who have committed suicide.",https://www.imdb.com/video/imdb/vi3434152217,tt0477139,7.3,67,Cinemascore,NA
Before The Devil Knows You're Dead,Before the Devil Knows You're Dead,2007,"Before the Devil Knows You're Dead is a movie starring Philip Seymour Hoffman, Ethan Hawke, and Albert Finney. When two brothers organize the robbery of their parent's jewelry store the job goes horribly wrong, triggering a series...",https://www.imdb.com/video/imdb/vi3636003097,tt0292963,7.3,88,Cinemascore,NA
Black Irish,Black Irish,2007,"Black Irish is a movie starring Michael Angarano, Brendan Gleeson, and Emily VanCamp. A teenage boy longs to win the attention of his emotionally distant father.",https://www.imdb.com/video/imdb/vi2344223001,tt0455915,7.0,,Cinemascore,NA
Dan In Real Life,Dan in Real Life,2007,"Dan in Real Life is a movie starring Steve Carell, Juliette Binoche, and Dane Cook. A widower finds out the woman he fell in love with is his brother's girlfriend.",https://www.imdb.com/video/imdb/vi414318873,tt0480242,6.7,64,Cinemascore,NA
How To Cook Your Life,How to Cook Your Life,2007,How to Cook Your Life is a movie starring Edward Espe Brown and Doris Dörrie. A Zen priest in San Francisco and cookbook author use Zen Buddhism and cooking to relate to everyday life.,https://www.imdb.com/video/imdb/vi279839001,tt0943512,6.1,72,Cinemascore,NA
Jimmy Carter Man From Plains,Jimmy Carter Man from Plains,2007,"Jimmy Carter Man from Plains is a movie starring Jimmy Carter, Rosalynn Carter, and Lillian Carter. A chronicle of the former president's tour recent for his book ""Palestine: Peace Not Apartheid.""",https://www.imdb.com/video/imdb/vi127074585,tt0913958,7.1,,Cinemascore,NA
Mr. Untouchable,Mr. Untouchable,2007,"Mr. Untouchable is a movie starring Leroy 'Nicky' Barnes, David Breitbart, and Walter Cronkite. The true-life story of a Harlem's notorious Nicky Barnes, a junkie turned multimillionaire drug-lord, MR. UNTOUCHABLE takes its audience...",NA,tt1086340,6.6,,Cinemascore,NA
Rails And Ties,Rails & Ties,2007,"Rails & Ties is a movie starring Kevin Bacon, Marcia Gay Harden, and Miles Heizer. A deadly collision between a train and car lead to an unlikely bond between the train engineer and a young boy who escapes the carnage.",https://www.imdb.com/video/imdb/vi971374873,tt0822849,6.7,,Cinemascore,NA
Saw 4,Saw IV,2007,"Saw IV is a movie starring Tobin Bell, Scott Patterson, and Louis Ferreira. Despite Jigsaw's death, and in order to save the lives of two of his colleagues, Lieutenant Rigg is forced to take part in a new game, which promises to...",https://www.imdb.com/video/imdb/vi3031499033,tt0890870,5.9,19,Cinemascore,NA
Slipstream,Slipstream,2007,"Slipstream is a movie starring Anthony Hopkins, Stella Hopkins, and Christian Slater. Aging screenwriter Felix Bonhoeffer has lived his life in two states of existence: in reality and his own interior world. While working on a...",https://www.imdb.com/video/imdb/vi310640921,tt0499570,4.9,,Cinemascore,NA
The Savages,The Savages,2007,"The Savages is a movie starring Laura Linney, Philip Seymour Hoffman, and Philip Bosco. A sister and brother face the realities of familial responsibility as they begin to care for their ailing father.",https://www.imdb.com/video/imdb/vi3522756889,tt0775529,7.1,,Cinemascore,NA
American Gangster,American Gangster,2007,"American Gangster is a movie starring Denzel Washington, Russell Crowe, and Chiwetel Ejiofor. An outcast New York City cop is charged with bringing down Harlem drug lord Frank Lucas, whose real life inspired this partly biographical...",https://www.imdb.com/video/imdb/vi3216048409,tt0765429,7.8,80,Cinemascore,NA
Bee Movie,Bee Movie,2007,"Bee Movie is a movie starring Jerry Seinfeld, Renée Zellweger, and Matthew Broderick. Barry B. Benson, a bee just graduated from college, is disillusioned at his lone career choice: making honey. On a special trip outside the hive,...",https://www.imdb.com/video/imdb/vi347210009,tt0389790,6.1,50,Cinemascore,NA
Darfur Now,Darfur Now,2007,"Darfur Now is a movie starring Don Cheadle, Ahmed Mahammed Abaka, and Sheikh Ahmed Mohamad Abakar. An examination of the genocide in Sudan's western region of Darfur.",https://www.imdb.com/video/imdb/vi3651141913,tt0988102,6.8,73,Cinemascore,NA
Joe Strummer: The Future Is Unwritten,Joe Strummer: The Future Is Unwritten,2007,"Joe Strummer: The Future Is Unwritten is a movie starring Joe Strummer, Steve Jones, and Mick Jones. As the front man of the Clash from 1977 onwards, Joe Strummer changed people's lives forever. Four years after his death, his...",https://www.imdb.com/video/imdb/vi714277145,tt0800099,7.6,89,Cinemascore,NA
Martian Child,Martian Child,2007,"Martian Child is a movie starring John Cusack, Amanda Peet, and Bobby Coleman. A science-fiction writer, recently widowed, considers whether to adopt a hyper-imaginative 6-year-old abandoned and socially rejected boy who says he's...",https://www.imdb.com/video/imdb/vi3652256025,tt0415965,6.8,34,Cinemascore,NA
Fred Clause,Fred Claus,2007,"Fred Claus is a movie starring Vince Vaughn, Paul Giamatti, and Elizabeth Banks. Fred Claus, Santa's bitter older brother, is forced to move to the North Pole to help Santa and the elves prepare for Christmas in exchange for cash.",https://www.imdb.com/video/imdb/vi363987225,tt0486583,5.6,,Cinemascore,NA
Lions For Lambs,Lions for Lambs,2007,"Lions for Lambs is a movie starring Tom Cruise, Meryl Streep, and Robert Redford. Injuries sustained by two Army rangers behind enemy lines in Afghanistan set off a sequence of events involving a congressman, a journalist and a...",https://www.imdb.com/video/imdb/vi1540162329,tt0891527,6.2,27,Cinemascore,NA
Om Shanti Om,Om Shanti Om,2007,"Om Shanti Om is a movie starring Shah Rukh Khan, Deepika Padukone, and Arjun Rampal. In the 1970s, Om, an aspiring actor, is murdered, but is immediately reincarnated into the present day. He attempts to discover the mystery of his...",https://www.imdb.com/video/imdb/vi3139549977,tt1024943,6.6,76,Cinemascore,NA
P2,P2,2007,"P2 is a movie starring Rachel Nichols, Wes Bentley, and Simon Reynolds. A businesswoman is pursued by a psychopath after being locked in a parking garage on Christmas Eve.",https://www.imdb.com/video/imdb/vi3350266137,tt0804516,5.9,33,Cinemascore,NA
Saawariya,Saawariya,2007,"Saawariya is a movie starring Ranbir Kapoor, Sonam Kapoor, and Salman Khan. Two souls arrive in a small town, one on vacation, the other to meet a lover. They spend the most magical dream-like days of their lives in that town......",https://www.imdb.com/video/imdb/vi1267007769,tt0758053,5.3,,Cinemascore,NA
The Life Of Reilly,The Life of Reilly,2007,"The Life of Reilly is a movie starring Charles Nelson Reilly. If, in 1940, you had a lobotomized aunt, an institutionalized father, a racist mother, and were the only gay kid on the block, what do you think the odds would be that...",NA,tt0498366,8.1,,Cinemascore,NA
Southland Tales,Southland Tales,2007,"Southland Tales is a movie starring Dwayne Johnson, Sarah Michelle Gellar, and Seann William Scott. During a three day heat wave just before a huge 4th of July celebration, an action star stricken with amnesia meets up with a porn...",https://www.imdb.com/video/imdb/vi3867410713,tt0405336,5.4,38,Cinemascore,NA
Beowulf,Beowulf,2007,"Beowulf is a movie starring Ray Winstone, Crispin Glover, and Angelina Jolie. The warrior Beowulf (Ray Winstone) must fight and defeat the monster Grendel (Crispin Glover), who is terrorizing Denmark, and later, Grendel's Mother...",https://www.imdb.com/video/imdb/vi3232825625,tt0442933,6.2,71,Cinemascore,NA
Love In The Time Of Cholera,Love in the Time of Cholera,2007,"Love in the Time of Cholera is a movie starring Javier Bardem, Giovanna Mezzogiorno, and Benjamin Bratt. Florentino, rejected by the beautiful Fermina at a young age, devotes much of his adult life to carnal affairs as a desperate...",https://www.imdb.com/video/imdb/vi3316711705,tt0484740,6.4,25,Cinemascore,NA
Margot At the Wedding,Margot at the Wedding,2007,"Margot at the Wedding is a movie starring Nicole Kidman, Jennifer Jason Leigh, and Flora Cross. Margot and her son Claude decide to visit her sister Pauline after she announces that she is marrying less-than-impressive Malcolm. In...",https://www.imdb.com/video/imdb/vi1167589657,tt0757361,6.0,52,Cinemascore,NA
Mr. Magorium's Wonder Emporium,Mr. Magorium's Wonder Emporium,2007,"Mr. Magorium's Wonder Emporium is a movie starring Natalie Portman, Dustin Hoffman, and Jason Bateman. Molly Mahoney is the awkward and insecure manager of Mr. Magorium's Wonder Emporium, the strangest, most fantastic, most...",https://www.imdb.com/video/imdb/vi2846949657,tt0457419,6.2,,Cinemascore,NA
Redacted,Redacted,2007,"Redacted is a movie starring Patrick Carroll, Rob Devaney, and Izzy Diaz. The devastating reconstruction of the rape and murder of a 15-year-old Iraqi girl by American soldiers in Samarra in 2006.",https://www.imdb.com/video/imdb/vi1568866585,tt0937237,6.1,45,Cinemascore,NA
Smiley Face,Smiley Face,2007,"Smiley Face is a movie starring Anna Faris, John Krasinski, and Adam Brody. After a young actress unknowingly eats her roommate's marijuana cupcakes, her day becomes a series of misadventures.",https://www.imdb.com/video/imdb/vi565313817,tt0780608,5.8,66,Cinemascore,NA
What Would Jesus Buy?,What Would Jesus Buy?,2007,"What Would Jesus Buy? is a movie starring Adetola Abiade, Paul Allen, and Paul Norman Allen. An examination of the commercialization of Christmas in America while following Reverend Billy and the Church of Stop Shopping Gospel Choir...",https://www.imdb.com/video/imdb/vi820117785,tt0939681,6.4,56,Cinemascore,NA
August,August Rush,2007,"August Rush is a movie starring Freddie Highmore, Keri Russell, and Jonathan Rhys Meyers. An orphaned musical prodigy uses his gift to try to find his birth parents.",https://www.imdb.com/video/imdb/vi380764441,tt0426931,7.5,,Cinemascore,NA
August Rush,August Rush,2007,"August Rush is a movie starring Freddie Highmore, Keri Russell, and Jonathan Rhys Meyers. An orphaned musical prodigy uses his gift to try to find his birth parents.",https://www.imdb.com/video/imdb/vi380764441,tt0426931,7.5,36,Cinemascore,NA
Enchanted,Enchanted,2007,"Enchanted is a movie starring Amy Adams, Susan Sarandon, and James Marsden. A young maiden in a land called Andalasia, who is prepared to be wed, is sent away to New York City by an evil queen, where she falls in love with a lawyer.",https://www.imdb.com/video/imdb/vi296878361,tt0461770,7.0,93,Cinemascore,NA
Hitman,Hitman,2007,"Hitman is a movie starring Timothy Olyphant, Dougray Scott, and Olga Kurylenko. A gun-for-hire known only as Agent 47 hired by a group known only as 'The Organization' is ensnared in a political conspiracy, which finds him pursued...",https://www.imdb.com/video/imdb/vi4004577561,tt0465494,6.3,15,Cinemascore,NA
I'm Not There,I'm Not There,2007,"I'm Not There is a movie starring Christian Bale, Cate Blanchett, and Heath Ledger. Ruminations on the life of Bob Dylan, where six characters embody a different aspect of the musician's life and work.",https://www.imdb.com/video/imdb/vi2746286361,tt0368794,6.9,,Cinemascore,NA
No Country For Old Men,No Country for Old Men,2007,"No Country for Old Men is a movie starring Tommy Lee Jones, Javier Bardem, and Josh Brolin. Violence and mayhem ensue after a hunter stumbles upon a drug deal gone wrong and more than two million dollars in cash near the Rio Grande.",https://www.imdb.com/video/imdb/vi145883417,tt0477348,8.1,93,Cinemascore,NA
This Christmas,This Christmas,2007,"This Christmas is a movie starring Regina King, Columbus Short, and Delroy Lindo. A Christmastime drama centered around the Whitfield family's first holiday together in four years.",https://www.imdb.com/video/imdb/vi3744137241,tt0937375,6.3,55,Cinemascore,NA
Midnight Eagle,Middonaito îguru,2007,"Middonaito îguru is a movie starring Tatsuya Fuji, Yoshihiko Hakamada, and Ken Ishiguro. As the Americans run Japan they also reserve the right to fly aeroplanes with nuclear weapons on board over the skies of the country. The...",NA,tt0997167,4.6,31,Cinemascore,NA
Starting Out In The Evening,Starting Out in the Evening,2007,"Starting Out in the Evening is a movie starring Frank Langella, Lauren Ambrose, and Patti Perkins. An ambitious graduate student convinces a writer that her thesis can resurrect his career.",https://www.imdb.com/video/imdb/vi4021354777,tt0758784,7.0,87,Cinemascore,NA
Aaja Nachle,Aaja Nachle,2007,"Aaja Nachle is a movie starring Madhuri Dixit, Darshan Jariwala, and Raghuvir Yadav. Dia's dance teacher is dying. She returns to the town where she learnt to live and dance and most importantly to save the endangered Ajanta theatre.",https://www.imdb.com/video/imdb/vi558085913,tt0986213,6.3,,Cinemascore,NA
Awake,Awake,2007,"Awake is a movie starring Hayden Christensen, Jessica Alba, and Terrence Howard. A wealthy young man undergoing heart transplant surgery discovers that the surgical team intend to murder him.",https://www.imdb.com/video/imdb/vi4138795289,tt0211933,6.5,17,Cinemascore,NA
He Was A Quiet Man,He Was a Quiet Man,2007,"He Was a Quiet Man is a movie starring Christian Slater, Elisha Cuthbert, and William H. Macy. An office worker inadvertently becomes a hero after he saves a woman's life.",https://www.imdb.com/video/imdb/vi2309751065,tt0760311,6.8,80,Cinemascore,NA
Protagonist,Protagonist,2007,"Protagonist is a movie starring Hans-Joachim Klein, Mark Salzman, and Chris Diamantopoulos. Jessica Yu's documentary explores the relationship between human life and Euripidean dramatic structure by weaving together the stories of...",https://www.imdb.com/video/imdb/vi2880373017,tt0905361,7.3,82,Cinemascore,NA
The Diving Bell And The Butterfly,Le scaphandre et le papillon,2007,"Le scaphandre et le papillon is a movie starring Mathieu Amalric, Emmanuelle Seigner, and Marie-Josée Croze. The true story of Elle editor Jean-Dominique Bauby who suffers a stroke and has to live with an almost totally paralyzed...",https://www.imdb.com/video/imdb/vi4122018073,tt0401383,8.0,,Cinemascore,NA
Juno,Juno,2007,"Juno is a movie starring Ellen Page, Michael Cera, and Jennifer Garner. Faced with an unplanned pregnancy, an offbeat young woman makes an unusual decision regarding her unborn child.",https://www.imdb.com/video/imdb/vi3400597785,tt0467406,7.4,94,Cinemascore,NA
Grace Is Gone,Grace Is Gone,2007,"Grace Is Gone is a movie starring John Cusack, Emily Churchill, and Rebecca Spence. Upon hearing his wife was killed in the Iraq war, a father takes his two daughters on a road trip.",https://www.imdb.com/video/imdb/vi2712731929,tt0772168,6.7,,Cinemascore,NA
Revolver,Revolver,2007,"Revolver is a movie starring Jason Statham, Ray Liotta, and André Benjamin. Gambler Jake Green enters into a game with potentially deadly consequences.",https://www.imdb.com/video/imdb/vi1621033241,tt0365686,6.4,,Cinemascore,NA
The Amateurs,The Moguls,2007,"The Moguls is a movie starring Jeff Bridges, Ted Danson, and Joe Pantoliano. Citizens of a small town, under the influence of a man in the midst of a mid-life crisis, come together to make an adult film.",https://www.imdb.com/video/imdb/vi2207580441,tt0405163,6.3,19,Cinemascore,NA
The Golden Compass,The Golden Compass,2007,"The Golden Compass is a movie starring Nicole Kidman, Daniel Craig, and Dakota Blue Richards. In a parallel universe, young Lyra Belacqua journeys to the far North to save her best friend and other kidnapped children from terrible...",https://www.imdb.com/video/imdb/vi2813395225,tt0385752,6.1,42,Cinemascore,NA
The Walker,The Walker,2007,"The Walker is a movie starring Woody Harrelson, Kristin Scott Thomas, and Lauren Bacall. An escort who caters to Washington D.C.'s society ladies becomes involved in a murder case.",https://www.imdb.com/video/imdb/vi816972057,tt0783608,5.8,52,Cinemascore,NA
Nanking,Nanking,2007,"Nanking is a movie starring Hugo Armstrong, Rosalind Chao, and Stephen Dorff. Through readings of historical account by actors and the testimony of survivors, the events of the Nanjing Massacre are recounted.",https://www.imdb.com/video/imdb/vi833749273,tt0893356,7.6,96,Cinemascore,NA
The Perfect Holiday,The Perfect Holiday,2007,"The Perfect Holiday is a movie starring Gabrielle Union, Morris Chestnut, and Queen Latifah. A young girl turns to a department store Santa in the hopes that he will help find a new husband for her divorced mother.",https://www.imdb.com/video/imdb/vi4054909209,tt0841032,4.5,,Cinemascore,NA
Alvin And The Chipmunks,Alvin and the Chipmunks,2007,"Alvin and the Chipmunks is a movie starring Jason Lee, Ross Bagdasarian Jr., and Janice Karman. Three musical chipmunks are discovered by an aspiring songwriter and wants to become famous by using their amazing singing abilities.",https://www.imdb.com/video/imdb/vi984744217,tt0952640,5.2,,Cinemascore,NA
I Am Legend,I Am Legend,2007,"I Am Legend is a movie starring Will Smith, Alice Braga, and Charlie Tahan. Years after a plague kills most of humanity and transforms the rest into monsters, the sole survivor in New York City struggles valiantly to find a cure.",https://www.imdb.com/video/imdb/vi3820028185,tt0480249,7.2,68,Cinemascore,NA
The Kite Runner,The Kite Runner,2007,"The Kite Runner is a movie starring Khalid Abdalla, Ahmad Khan Mahmoodzada, and Atossa Leoni. After spending years in California, Amir returns to his homeland in Afghanistan to help his old friend Hassan, whose son is in trouble.",https://www.imdb.com/video/imdb/vi955580697,tt0419887,7.6,,Cinemascore,NA
Youth Without Youth,Youth Without Youth,2007,"Youth Without Youth is a movie starring Tim Roth, Alexandra Maria Lara, and Bruno Ganz. A love story wrapped in a mystery. Set in World War II Europe, a professor is changed by a cataclysmic event and explores the mysteries of life.",https://www.imdb.com/video/imdb/vi246546713,tt0481797,6.3,32,Cinemascore,NA
Charlie Wilson's War,Charlie Wilson's War,2007,"Charlie Wilson's War is a movie starring Tom Hanks, Julia Roberts, and Philip Seymour Hoffman. A drama based on a Texas congressman Charlie Wilson's covert dealings in Afghanistan, where his efforts to assist rebels in their war...",https://www.imdb.com/video/imdb/vi95551769,tt0472062,7.0,82,Cinemascore,NA
